NUMCPT,NOMCLI,TYPE_CLIENT,SECTEUR_CLIENT,CONSOLIDATION_CLIENT,CODAME,CODGVR,SERVICE_TYPE
439452,MIN.FIN.TRESORERIE REGIONALE DE SFAX,GENERAL,ADMINISTRATION,TRESORERIE REGIONALE DE SFAX,MIN.FIN.,,
439462,MIN.SANTE PUB. HOPITAL CIRCONS.MAGEL BEL ABBES,GENERAL,ADMINISTRATION,HOPITAL CIRCONS.MAGEL BEL ABBES,MIN.SANTE PUB.,,
439472,MIN.AFF.FEM.FAM.ENF. CENTRE INTEGRE JEUN.ENF.DE SOUASSI,GENERAL,ADMINISTRATION,CENTRE INTEGRE JEUN.ENF.DE SOUASSI,MIN.AFF.FEM.FAM.ENF.,,
439482,MIN.INTER.DEV.LOC. COMMUNE DE BOUHAJLA,GENERAL,ADMINISTRATION,COMMUNE DE BOUHAJLA,MIN.INTER.DEV.LOC.,,
439492,MIN.INTER.DEV.LOC. COMMUNE AGAREB,GENERAL,ADMINISTRATION,COMMUNE AGAREB,MIN.INTER.DEV.LOC.,,
439502,MIN.ENS.SUP.RECH.SC.TECH.CENTRE RECH.ETUDES DIALOGUES CIVIL.RELIG.COMP,GENERAL,ADMINISTRATION,CENTRE RECH.ETUDES DIALOGUES CIVIL.RELIG.COMP,MIN.ENS.SUP.RECH.SC.,,
439512,MIN.SPORTS MAISON DES JEUNES,GENERAL,ADMINISTRATION,MAISON DES JEUNES,MIN.JEUN.SPORTS EDUC.PHYS.,,
439522,MIN.ENS.SUP.RECH.SC.TECH.INSTITUT SUP.SYSTEMES INDUSTRIELS,GENERAL,ADMINISTRATION,INSTITUT SUP.SYSTEMES INDUSTRIELS,MIN.ENS.SUP.RECH.SC.,,
439532,MIN.INTER.DEV.LOC.COMMUNE DE SBIBA,GENERAL,ADMINISTRATION,COMMUNE DE SBIBA,MIN.INTER.DEV.LOC.,,
439542,MIN.INTER.DEV.LOC. COMMUNE DE MENZEL ENNOUR,GENERAL,ADMINISTRATION,COMMUNE DE MENZEL ENNOUR,MIN.INTER.DEV.LOC.,,
439552,MIN.ENS.SUP.RECH.SC.TECH.INSTITUT SUP.SC.TECHNOL.ENERGIE,GENERAL,ADMINISTRATION,INSTITUT SUP.SC.TECHNOL.ENERGIE,MIN.ENS.SUP.RECH.SC.,,
439562,MIN.INTER.DEV.LOC.CAISSE REG.DEV.ACTIV.CULT.JEUN.SPORT,GENERAL,ADMINISTRATION,CAISSE REG.DEV.ACTIV.CULT.JEUN.SPORT,MIN.INTER.DEV.LOC.,,
439572,MIN.AGRIC.ENV.RESS.HYD.CENTRE REG.DES RECHERCHES AGRIC.OASIENNE,GENERAL,ADMINISTRATION,CENTRE REG.DES RECHERCHES AGRIC.OASIENNE,MIN.AGRIC.ENV.RESS.HYD.,,
439582,MIN.ENS.SUP.RECH.SC.TECH. INSTITUT SUP.ARTS ET METIERS,GENERAL,ADMINISTRATION,INSTITUT SUP.ARTS ET METIERS,MIN.ENS.SUP.RECH.SC.,,
439592,MIN.EMPLOI CENTRE DE FORM.ET D'APPRENTISSAGE PROF.,GENERAL,ADMINISTRATION,CENTRE DE FORM.ET D'APPRENTISSAGE PROF.,MIN.EMPLOI,,
439602,MIN.SPORTS INSTITUT SUP.SPORTS EDUC.PHYS.,GENERAL,ADMINISTRATION,INSTITUT SUP.SPORTS EDUC.PHYS.,MIN.JEUN.SPORTS EDUC.PHYS.,,
439612,MIN.ENS.SUP.RECH.SC.TECH.INSTITUT SUP.DES MATHEMATIQUES APPL.ET INFOR.,GENERAL,ADMINISTRATION,INSTITUT SUP.DES MATHEMATIQUES APPL.ET INFOR.,MIN.ENS.SUP.RECH.SC.,,
439622,MIN.SANTE PUB.INSTITUT SUP.DES SCIENCES INFIRMIERES,GENERAL,ADMINISTRATION,INSTITUT SUP.DES SCIENCES INFIRMIERES,MIN.SANTE PUB.,,
439632,MIN.ENS.SUP.RECH.SC.TECH.ECOLE SUP.DES SCIENCES ET TECHNOLOGIES,GENERAL,ADMINISTRATION,ECOLE SUP.DES SCIENCES ET TECHNOLOGIES,MIN.ENS.SUP.RECH.SC.,,
439642,MIN.ENS.SUP.RECH.SC.TECH.INST.SUP.ETUDES APPL.EN HUMANITES,GENERAL,ADMINISTRATION,INST.SUP.ETUDES APPL.EN HUMANITES,MIN.ENS.SUP.RECH.SC.,,
439652,MIN.ENS.SUP.RECH.SC.TECH.INSTITUT SUPERIEUR D'INFORMATIQUE,GENERAL,ADMINISTRATION,INSTITUT SUPERIEUR D'INFORMATIQUE,MIN.ENS.SUP.RECH.SC.,,
439662,MIN.INTER.DEV.LOC.COMMUNE DE MESSADINE,GENERAL,ADMINISTRATION,COMMUNE DE MESSADINE,MIN.INTER.DEV.LOC.,,
439672,MIN.INTER.DEV.LOC.COMMUNE BIR ALI BEN KHELIFA,GENERAL,ADMINISTRATION,COMMUNE BIR ALI BEN KHELIFA,MIN.INTER.DEV.LOC.,,
439682,MIN.ENS.SUP.RECH.SC.TECH.INSTITUT SUP.DES SC.INFIRMIERES,GENERAL,ADMINISTRATION,INSTITUT SUP.DES SC.INFIRMIERES,MIN.ENS.SUP.RECH.SC.,,
439692,MIN.INTER.DEV.LOC.COMMUNE REDAYEF,GENERAL,ADMINISTRATION,COMMUNE REDAYEF,MIN.INTER.DEV.LOC.,,
439702,"MIN.EDUC.FORM.ECOLE PREPARATOIRE "" ENNOUR "" DES AVEUGLES",GENERAL,ADMINISTRATION,"ECOLE PREPARATOIRE "" ENNOUR "" DES AVEUGLES",MIN.EDUC.,,
439711,MIN.AGRIC.CENTRE REG.RECH.HORICULTURE ET AGRICULTURE BIOLOGIQUE,GENERAL,ADMINISTRATION,MIN.AGRIC.CENTRE REG.RECH.HORICULTURE ET AGRICULTURE BIOLOGIQUE,MIN.AGRIC.ENV.RESS.HYD.,,
439722,MIN.JEUN.SPORTS EDUC.PHYS. CENTRE D'ATHLETISME,GENERAL,ADMINISTRATION,CENTRE D'ATHLETISME,MIN.JEUN.SPORTS EDUC.PHYS.,,
439732,MIN.INTER.DEV.LOC. COMMUNE DE KHENISS,GENERAL,ADMINISTRATION,COMMUNE DE KHENISS,MIN.INTER.DEV.LOC.,,
439742,MIN.ENS.SUP.RECH.SC.TECH.LE PALAIS DES SCIENCES,GENERAL,ADMINISTRATION,LE PALAIS DES SCIENCES,MIN.ENS.SUP.RECH.SC.,,
439752,MIN.EDUC.FORM.ECOLE PREPARATOIRE SIDI EL HENI,GENERAL,ADMINISTRATION,ECOLE PREPARATOIRE SIDI EL HENI,MIN.EDUC.,,
439762,MIN.EDUC.     ECOLE PREPARATOIRE  IBN MOUKAFA,GENERAL,ADMINISTRATION,MIN.EDUC.     ECOLE PREPARATOIRE  IBN MOUKAFA,MIN.EDUC.,,
439772,MIN.EDUC.FORM.INSTITUT DES METIERS DE L'EDUC.ET DE FORM.,GENERAL,ADMINISTRATION,INSTITUT DES METIERS DE L'EDUC.ET DE FORM.,MIN.EDUC.,,
439782,MIN.AFF.SOC.SOLID.CENTRE D'ASSISTANCE ET D'ORIENTATION SOCIALE,GENERAL,ADMINISTRATION,CENTRE D'ASSISTANCE ET D'ORIENTATION SOCIALE,MIN.AFF.FEM.FAM.ENF.,,
439792,MIN.ENS.SUP.RECH.SC.TECH. CITE UNIVERSITAIRE DE TOZEUR,GENERAL,ADMINISTRATION,CITE UNIVERSITAIRE DE TOZEUR,MIN.ENS.SUP.RECH.SC.,,
439802,MIN.ENS.SUP.RECH.SC.TECH. CITE UNIVERSITAIRE DE TATAOUINE,GENERAL,ADMINISTRATION,CITE UNIVERSITAIRE DE TATAOUINE,MIN.ENS.SUP.RECH.SC.,,
439812,MIN.ENS.SUP.RECH.SC.TECH.INST.SUP.DES ARTS ET METIERS,GENERAL,ADMINISTRATION,INST.SUP.DES ARTS ET METIERS,MIN.ENS.SUP.RECH.SC.,,
439822,MIN.INTER.DEV.LOC.COMMUNE EL GHREIBA,GENERAL,ADMINISTRATION,COMMUNE EL GHREIBA,MIN.INTER.DEV.LOC.,,
439832,MIN.ENS.SUP.RECH.SC.TECH.INST.PREP.AUX ETUDES D'INGENIEURS,GENERAL,ADMINISTRATION,INST.PREP.AUX ETUDES D'INGENIEURS,MIN.ENS.SUP.RECH.SC.,,
439842,MIN.EDUC.FORM.LYCEE EL MAZZOUNA,GENERAL,ADMINISTRATION,LYCEE EL MAZZOUNA,MIN.EDUC.,,
439852,MIN.INTER.DEV.LOC. COMMUNE CHERARDA,GENERAL,ADMINISTRATION,COMMUNE CHERARDA,MIN.INTER.DEV.LOC.,,
439862,MIN.EDUC.FORM. ECOLE PREPARATOIRE DE MEZZOUNA,GENERAL,ADMINISTRATION,ECOLE PREPARATOIRE DE MEZZOUNA,MIN.EDUC.,,
439872,MIN.AGRIC.ENV.RESS.HYD. C. F. P. A  KEBILI,GENERAL,ADMINISTRATION,C. F. P. A  KEBILI,MIN.AGRIC.ENV.RESS.HYD.,,
439882,MIN.INTER.DEV.LOC.COMMUNE DE JEDELIANE,GENERAL,ADMINISTRATION,COMMUNE DE JEDELIANE,MIN.INTER.DEV.LOC.,,
439892,MIN.DEV.COOP.INTER. COMMUNE DE SIDI ALOUANE,GENERAL,ADMINISTRATION,COMMUNE DE SIDI ALOUANE,MIN.DEV.COOP.INTER.,,
439902,MIN.AFF.SOC.SOLID.CENTRE DE DEFENSE ET D'INTEGRATION SOCIALE,GENERAL,ADMINISTRATION,CENTRE DE DEFENSE ET D'INTEGRATION SOCIALE,MIN.AFF.FEM.FAM.ENF.,,
439912,MIN.TOURISME COMMISSARIAT REGIONAL AU TOURISME,GENERAL,ADMINISTRATION,COMMISSARIAT REGIONAL AU TOURISME,MIN.TOURIS.COMM.ART.,,
439922,MIN.TOURIS. INSTITUT SUPERIEUR PROF.DE TOURISME,GENERAL,ADMINISTRATION,INSTITUT SUPERIEUR PROF.DE TOURISME,MIN.TOURIS.COMM.ART.,,
439932,MIN.INTER.DEV.LOC.ECOLE NLE.DE FORM.CONT.DE LA GARDE NLE.,GENERAL,ADMINISTRATION,ECOLE NLE.DE FORM.CONT.DE LA GARDE NLE.,MIN.INTER.DEV.LOC.,,
439942,MIN.TOURIS.ECOLE DE TOURISME SOUSSE NORD . KANTAOUI,GENERAL,ADMINISTRATION,ECOLE DE TOURISME SOUSSE NORD . KANTAOUI,MIN.TOURIS.COMM.ART.,,
439952,MIN.INTER.DEV.LOC. COMMUNE GOLAA,GENERAL,ADMINISTRATION,COMMUNE GOLAA,MIN.INTER.DEV.LOC.,,
439962,MIN.EDUC. COMMISSARIAT REG.DE L'EDUCATION SFAX II,GENERAL,ADMINISTRATION,MIN.EDUC. COMMISSARIAT REG.DE L'EDUCATION SFAX II,MIN.EDUC.,,
439972,MIN.INTER.DEV.LOC.COMMUNE DE BRADAA,GENERAL,ADMINISTRATION,COMMUNE DE BRADAA,MIN.INTER.DEV.LOC.,,
439982,MIN.INTER.COMMUNE KSIBET ET THRAYET,GENERAL,ADMINISTRATION,COMMUNE KSIBET ET THRAYET,MIN.INTER.DEV.LOC.,,
439992,MIN.INTER.  COMMUNE DE SNED,GENERAL,ADMINISTRATION,COMMUNE DE SNED,MIN.INTER.DEV.LOC.,,
477652,RESTAURANT UNIVERSITAIRE  SIDI BOUZID,GENERAL,ADMINISTRATION,RESTAURANT UNIVERSITAIRE  SIDI BOUZID,MIN.ENS.SUP.RECH.SC.,,
477662,MUNICIPALITE  FAIEDH BENNOUR,GENERAL,ADMINISTRATION,MUNICIPALITE  FAIEDH BENNOUR,MIN.INTER.DEV.LOC.,,
477672,MUNICIPALITE  HKAIMA,GENERAL,ADMINISTRATION,MUNICIPALITE  HKAIMA,MIN.INTER.DEV.LOC.,,
560011,MIN.EQUIP.HAB.AMEN.TERR.D. A. F.,GENERAL,ADMINISTRATION,D. A. F.,MIN.EQUIP.HAB.AMEN.TERR.,,
560022,MIN.EQUIP.HAB.AMEN.TERR.  DIRECTION GENERALE DE L'AMENAGEMENT DU TERRI,GENERAL,ADMINISTRATION,DIRECTION GENERALE DE L'AMENAGEMENT DU TERRI,MIN.EQUIP.HAB.AMEN.TERR.,,
560032,MIN.EQUIP.HAB.AMEN.TERR.UNITE DE REALISATION DE LA CITE OLYMPIQUE 0,GENERAL,ADMINISTRATION,UNITE DE REALISATION DE LA CITE OLYMPIQUE 0,MIN.EQUIP.HAB.AMEN.TERR.,,
560042,MIN.EQUIP.HAB.AMEN.TERR.  UNITE DES LOGEMENTS SOCIAUX,GENERAL,ADMINISTRATION,UNITE DES LOGEMENTS SOCIAUX,MIN.EQUIP.HAB.AMEN.TERR.,,
560062,MIN.EQUIP.HAB.AMEN.TERR.SUBD.CONSTRUCTION  TUNIS 2,GENERAL,ADMINISTRATION,SUBD.CONSTRUCTION  TUNIS 2,MIN.EQUIP.HAB.AMEN.TERR.,,
560082,MIN.EQUIP.HAB.AMEN.TERR.SUBD.CONST.TUNIS 4,GENERAL,ADMINISTRATION,SUBD.CONST.TUNIS 4,MIN.EQUIP.HAB.AMEN.TERR.,,
560102,MIN.EQUIP. DIRECTION REGIONALE DE L'EQUIPEMENT,GENERAL,ADMINISTRATION,DIRECTION REG.DE L'EQUIP.ET DE L'HABITAT DE,MIN.EQUIP.HAB.AMEN.TERR.,,
560112,MIN.EQUIP.HAB.AMEN.TERR.DIR.GLE. DES SCES AER.ET MARITIMES,GENERAL,ADMINISTRATION,DIR.GLE. DES SCES AER.ET MARITIMES,MIN.EQUIP.HAB.AMEN.TERR.,,
560122,MIN.TECH.COMM.TRANSP.LA POSTE TUNISIENNE-DIRECTION REG.DE MANOUB,GENERAL,ADMINISTRATION,LA POSTE TUNISIENNE-DIRECTION REG.DE MANOUB,MIN.TECH.COMM.,,
560132,MIN.EMPLOICENTRE SECT .DE FORMATION EN TRANSPORT ET L,GENERAL,ADMINISTRATION,CENTRE SECT .DE FORMATION EN TRANSPORT ET L,MIN.EMPLOI,,
560152,MIN.EQUIP.HAB.AMEN.TERR.D.G.S.A.M,GENERAL,ADMINISTRATION,D.G.S.A.M,MIN.EQUIP.HAB.AMEN.TERR.,,
560162,MIN.EQUIP.HAB.AMEN.TERR.DIR.REG.EQUIP.HAB.AMEN.TERR.,GENERAL,ADMINISTRATION,DIR.REG.EQUIP.HAB.AMEN.TERR.,MIN.EQUIP.HAB.AMEN.TERR.,,
560171,MIN.EQUIP.HAB.AMEN.TERR.SUBD P C,GENERAL,ADMINISTRATION,SUBD P C,MIN.EQUIP.HAB.AMEN.TERR.,,
560192,MIN.ENS.SUP.RECH.SC.TECH.INSTITUT SUP. DES TECHNOLOGIES MEDICALES,GENERAL,ADMINISTRATION,INSTITUT SUP. DES TECHNOLOGIES MEDICALES,MIN.ENS.SUP.RECH.SC.,,
560201,MIN.EQUIP.HAB.AMEN.TERR.DIRECTION REG. DES PONTS ET CHAUSSEES,GENERAL,ADMINISTRATION,DIRECTION REG. DES PONTS ET CHAUSSEES,MIN.EQUIP.HAB.AMEN.TERR.,,
560212,MIN.ENS.SUP.RECH.SC.TECH.INSTITUT SUP. D'INFORMATIQUE,GENERAL,ADMINISTRATION,INSTITUT SUP. D'INFORMATIQUE,MIN.ENS.SUP.RECH.SC.,,
560222,MIN.ENS.SUP.RECH.SC.TECH.INSTITUT PREP.AUX ETUDES D'INGENIEURS D'EL,GENERAL,ADMINISTRATION,INSTITUT PREP.AUX ETUDES D'INGENIEURS D'EL,MIN.ENS.SUP.RECH.SC.,,
560242,MIN.ENS.SUP.RECH.SC.TECH.ECOLE SUP.DE LA STATISTIQUE ET DE L'ANALYSE,GENERAL,ADMINISTRATION,ECOLE SUP.DE LA STATISTIQUE ET DE L'ANALYSE,MIN.ENS.SUP.RECH.SC.,,
560252,MIN.DEF.NAT.            DIRECTION GENERALE DES TRAVAUX,GENERAL,ADMINISTRATION,DIRECTION GENERALE DES TRAVAUX,MIN.DEF.NAT.,,
560262,MIN.AFF.SOC.SOLID.CENTRE D'ENCADREMENT ET D'ORIENTATION SOCIALE,GENERAL,ADMINISTRATION,CENTRE D'ENCADREMENT ET D'ORIENTATION SOCIALE,MIN.AFF.FEM.FAM.ENF.,,
560272,MIN.INTER.DEV.LOC.COMMUNE DJEBEL EL OUEST,GENERAL,ADMINISTRATION,COMMUNE DJEBEL EL OUEST,MIN.INTER.DEV.LOC.,,
560282,MIN.ENS.SUP.RECH.SC.TECH.RESTAURANT UNIVERSITAIRE ALI DOUAGI ( INSAT,GENERAL,ADMINISTRATION,RESTAURANT UNIVERSITAIRE ALI DOUAGI ( INSAT,MIN.ENS.SUP.RECH.SC.,,
560292,MIN.ENS.SUP.RECH.SC.TECH.UNIVERSITE VIRTUELLE DE TUNIS,GENERAL,ADMINISTRATION,UNIVERSITE VIRTUELLE DE TUNIS,MIN.ENS.SUP.RECH.SC.,,
560302,"MIN.AFF.SOC.SOLID.CENTRE SICIO-EDUCATIF ""ESSAND""",GENERAL,ADMINISTRATION,"CENTRE SICIO-EDUCATIF ""ESSAND""",MIN.AFF.FEM.FAM.ENF.,,
560322,MIN.EQUIP.HAB.AMEN.TERR.SCE. CONTROLEOUVRAGES D'ART,GENERAL,ADMINISTRATION,SCE. CONTROLEOUVRAGES D'ART,MIN.EQUIP.HAB.AMEN.TERR.,,
560332,MIN.INTER.DEV.LOC.GOUVERNORAT DE NABEUL- SECTEUR DE POLICE NA,GENERAL,ADMINISTRATION,GOUVERNORAT DE NABEUL- SECTEUR DE POLICE,MIN.INTER.DEV.LOC.,,
560342,MIN.TECH.COMM.TRANSP.ECOLE SUPERIEURE DES COMMUNICATIONS DE TUNI,GENERAL,ADMINISTRATION,ECOLE SUPERIEURE DES COMMUNICATIONS DE TUNI,MIN.TECH.COMM.,,
560352,MIN.INTER.DEV.LOC.GOUVERNORAT DE ZAGHOUAN- SECTEUR DE POLICE,GENERAL,ADMINISTRATION,GOUVERNORAT DE ZAGHOUAN- SECTEUR DE POLICE,MIN.INTER.DEV.LOC.,,
560362,MIN.ENS.SUP.RECH.SC. INSTITUT SUP.DE CONSTRUCTION ET D'URBANISME,GENERAL,ADMINISTRATION,MIN.ENS.SUP.RECH.SC. INSTITUT SUP.DE CONSTRUCTION ET D'URBANISME,MIN.ENS.SUP.RECH.SC.,,
560371,MIN.EQUIP.HAB.AMEN.TERR.LABORATOIRE P.C.,GENERAL,ADMINISTRATION,LABORATOIRE P.C.,MIN.EQUIP.HAB.AMEN.TERR.,,
560382,MIN.EQUIP.HAB.AMEN.TERR.DIRECTION GLE.DES SERVICES AERIENS ET MARIT,GENERAL,ADMINISTRATION,DIRECTION GLE.DES SERVICES AERIENS ET MARIT,MIN.EQUIP.HAB.AMEN.TERR.,,
560392,MIN.EQUIP.HAB.AMEN.TERR.SCE.MODERNISATION DES ROUTES,GENERAL,ADMINISTRATION,SCE.MODERNISATION DES ROUTES,MIN.EQUIP.HAB.AMEN.TERR.,,
560402,MIN.ENS.SUP.RECH.SC.TECH.ECOLE  NATIONALE D'INGENIEURS DE CARTHAGE,GENERAL,ADMINISTRATION,ECOLE  NATIONALE D'INGENIEURS DE CARTHAGE,MIN.ENS.SUP.RECH.SC.,,
560412,MIN.ENS.SUP.RECH.SC.TECH.INSTITUT SUP.DES ETUDES TECHNOLOGIQUES,GENERAL,ADMINISTRATION,INSTITUT SUP.DES ETUDES TECHNOLOGIQUES,MIN.ENS.SUP.RECH.SC.,,
560422,MIN.EDUC.FORM. ECOLE PREPARATOIRE EL AGBA,GENERAL,ADMINISTRATION,ECOLE PREPARATOIRE EL AGBA,MIN.EDUC.,,
560432,MIN.ENS.SUP.RECH.SC.TECH.INSTITUT SUP.DES ETUDES LITTERAIRES ET HUM.,GENERAL,ADMINISTRATION,INSTITUT SUP.DES ETUDES LITTERAIRES ET HUM.,MIN.ENS.SUP.RECH.SC.,,
560442,MIN.EDUC.FORM.CENTRE REG.DE L'EDUCATION ET DE LA FORMATIO,GENERAL,ADMINISTRATION,CENTRE REG.DE L'EDUCATION ET DE LA FORMATIO,MIN.EDUC.,,
560452,MIN.JUSTICE DROITS HOMMECENTRE D'ETUDES JURIDIQUES ET JUDICIAIRES,GENERAL,ADMINISTRATION,CENTRE D'ETUDES JURIDIQUES ET JUDICIAIRES,MIN.JUSTICE DROITS HOMME,,
560462,"MIN.ENS.SUP.RECH.SC.TECH.CENTRE UNIV.D'ANIM.CULT.ET SPORTIVE""IBN ABI",GENERAL,ADMINISTRATION,"CENTRE UNIV.D'ANIM.CULT.ET SPORTIVE""IBN ABI",MIN.ENS.SUP.RECH.SC.,,
560472,MIN.FIN.UNITE DE COMPENSATION DES PRODUITS DE BASE,GENERAL,ADMINISTRATION,UNITE DE COMPENSATION DES PRODUITS DE BASE,MIN.FIN.,,
560482,MIN.ENS.SUP.RECH.SC.TECH.FOYER UNIVERSITAIRE TAHER HADDED,GENERAL,ADMINISTRATION,FOYER UNIVERSITAIRE TAHER HADDED,MIN.ENS.SUP.RECH.SC.,,
560491,MIN.EQUIP.HAB.AMEN.TERR.SCE.STATION ROUTIER,GENERAL,ADMINISTRATION,SCE.STATION ROUTIER,MIN.EQUIP.HAB.AMEN.TERR.,,
560511,MIN.EQUIP.HAB.AMEN.TERR.DIRECTION GENERALE DES BATIMENTS  CIVILS,GENERAL,ADMINISTRATION,DIRECTION GENERALE DES BATIMENTS  CIVILS,MIN.EQUIP.HAB.AMEN.TERR.,,
560522,MIN.EQUIP.HAB.AMEN.TERR.SCE JURIDIQUE CONTENTIEUX,GENERAL,ADMINISTRATION,SCE JURIDIQUE CONTENTIEUX,MIN.EQUIP.HAB.AMEN.TERR.,,
560542,MIN.EQUIP.HAB.AMEN.TERR.P.C SCE CENTRAL,GENERAL,ADMINISTRATION,P.C SCE CENTRAL,MIN.EQUIP.HAB.AMEN.TERR.,,
560552,MIN.EQUIP.HAB.AMEN.TERR.SCE.ETUDES TECHNIQUES,GENERAL,ADMINISTRATION,SCE.ETUDES TECHNIQUES,MIN.EQUIP.HAB.AMEN.TERR.,,
560562,MIN.EQUIP.HAB.AMEN.TERR.DIR.REG.EQUIP.HAB.AMEN.TERR.,GENERAL,ADMINISTRATION,DIR.REG.EQUIP.HAB.AMEN.TERR.,MIN.EQUIP.HAB.AMEN.TERR.,,
560572,MIN.ENS.SUP.RECH.SC.TECH. INSTITUT SUP.SC.BIOLOGIQUES APPLIQUES,GENERAL,ADMINISTRATION,INSTITUT SUP.SC.BIOLOGIQUES APPLIQUES,MIN.ENS.SUP.RECH.SC.,,
560582,MIN.AFF.FEM.FAM.ENF. CENTRE 7 NOV. DES VACANCES ET DES LOISIRS,GENERAL,ADMINISTRATION,CENTRE 7 NOV. DES VACANCES ET DES LOISIRS,MIN.AFF.FEM.FAM.ENF.,,
560592,MIN.ENS.SUP.RECH.SC.TECH. RESTAURANT UNIV.MUSTAPHA KHERAIEF,GENERAL,ADMINISTRATION,RESTAURANT UNIV.MUSTAPHA KHERAIEF,MIN.ENS.SUP.RECH.SC.,,
560612,MIN.SANTE PUB. I.N.N,GENERAL,ADMINISTRATION,I.N.N,MIN.SANTE PUB.,,
560622,MIN.ENS.SUP.RECH.SC.TECH. FOYER UNIVERS.MOUSSA IBN NOUSSAIER,GENERAL,ADMINISTRATION,FOYER UNIVERS.MOUSSA IBN NOUSSAIER,MIN.ENS.SUP.RECH.SC.,,
560632,MIN.EQUIP.HAB.AMEN.TERR.SUBD.TRAVAUX COMMUNAUX,GENERAL,ADMINISTRATION,SUBD.TRAVAUX COMMUNAUX,MIN.EQUIP.HAB.AMEN.TERR.,,
560641,MIN.EQUIP.HAB.AMEN.TERR.DIR.REG. DE NABEUL - SCE. DES P.C,GENERAL,ADMINISTRATION,DIR.REG. DE NABEUL - SCE. DES P.C,MIN.EQUIP.HAB.AMEN.TERR.,,
560652,MIN.EQUIP.HAB.AMEN.TERR.SCE.INFRASTRUCTURE ROUTIER,GENERAL,ADMINISTRATION,SCE.INFRASTRUCTURE ROUTIER,MIN.EQUIP.HAB.AMEN.TERR.,,
560662,MIN.EQUIP.HAB.AMEN.TERR.SCE.DES TVX NEUFS ROUTIER,GENERAL,ADMINISTRATION,SCE.DES TVX NEUFS ROUTIER,MIN.EQUIP.HAB.AMEN.TERR.,,
560681,MIN.EQUIP.HAB.AMEN.TERR.ARRONDISSEMENT DE ZAGHOUAN,GENERAL,ADMINISTRATION,ARRONDISSEMENT DE ZAGHOUAN,MIN.EQUIP.HAB.AMEN.TERR.,,
560692,MIN.EQUIP.HAB.AMEN.TERR.CENTRE TECH.POUR DEV.CONSTRUCTION,GENERAL,ADMINISTRATION,CENTRE TECH.POUR DEV.CONSTRUCTION,MIN.EQUIP.HAB.AMEN.TERR.,,
560702,MIN.EQUIP.HAB.AMEN.TERR.ARROND.TUNIS SUBD.URBANISME,GENERAL,ADMINISTRATION,ARROND.TUNIS SUBD.URBANISME,MIN.EQUIP.HAB.AMEN.TERR.,,
560711,MIN.AGRIC.ENV.RESS.HYD.D G T H,GENERAL,ADMINISTRATION,D G T H,MIN.AGRIC.ENV.RESS.HYD.,,
560722,MIN.AGRIC.ENV.RESS.HYD.DGTH AMENAGEMENT FONCIER,GENERAL,ADMINISTRATION,DGTH AMENAGEMENT FONCIER,MIN.AGRIC.ENV.RESS.HYD.,,
560732,MIN.EQUIP.HAB.AMEN.TERR.ARROND. TUNIS 2,GENERAL,ADMINISTRATION,ARROND. TUNIS 2,MIN.EQUIP.HAB.AMEN.TERR.,,
560742,MIN.EQUIP.HAB.AMEN.TERR.D. S. A. M.,GENERAL,ADMINISTRATION,D. S. A. M.,MIN.EQUIP.HAB.AMEN.TERR.,,
560751,MIN.EQUIP.HAB.AMEN.TERR.SCE. DE L'EXPLOITATION DES ROUTES,GENERAL,ADMINISTRATION,SCE. DE L'EXPLOITATION DES ROUTES,MIN.EQUIP.HAB.AMEN.TERR.,,
560762,MIN.EQUIP.HAB.AMEN.TERR.E. G. T. H.,GENERAL,ADMINISTRATION,E. G. T. H.,MIN.EQUIP.HAB.AMEN.TERR.,,
560772,MIN.EQUIP.HAB.AMEN.TERR.D. A. F.,GENERAL,ADMINISTRATION,D. A. F.,MIN.EQUIP.HAB.AMEN.TERR.,,
560782,MIN.AGRIC.ENV.RESS.HYD.DGTH,GENERAL,ADMINISTRATION,DGTH,MIN.AGRIC.ENV.RESS.HYD.,,
560791,MIN.AGRIC.ENV.RESS.HYD.DGTH LABO CENTRAL,GENERAL,ADMINISTRATION,DGTH LABO CENTRAL,MIN.AGRIC.ENV.RESS.HYD.,,
560802,MIN.EQUIP.HAB.AMEN.TERR.SOUS DIRECTION GRANDS TVX.,GENERAL,ADMINISTRATION,SOUS DIRECTION GRANDS TVX.,MIN.EQUIP.HAB.AMEN.TERR.,,
560812,MIN.AGRIC.ENV.RESS.HYD.DIR.GRANDS TRAVAUX HYDRAULIQUE PROJET GAMGOUM,GENERAL,ADMINISTRATION,DIR.GRANDS TRAVAUX HYDRAULIQUE PROJET GAMGOUM,MIN.AGRIC.ENV.RESS.HYD.,,
560821,MIN.EQUIP.HAB.AMEN.TERR.SCE.INFRAST. TANSPORT,GENERAL,ADMINISTRATION,SCE.INFRAST. TANSPORT,MIN.EQUIP.HAB.AMEN.TERR.,,
560831,MIN.EQUIP.HAB.AMEN.TERR.DIR.REGIONALE DE L'EQUIPEMENT ET DE L'HABIT,GENERAL,ADMINISTRATION,DIR.REGIONALE DE L'EQUIPEMENT ET DE L'HABIT,MIN.EQUIP.HAB.AMEN.TERR.,,
560842,MIN.EQUIP.HAB.AMEN.TERR.SCE.BATIMENTS CIVILS,GENERAL,ADMINISTRATION,SCE.BATIMENTS CIVILS,MIN.EQUIP.HAB.AMEN.TERR.,,
560852,MIN.AGRIC.ENV.RESS.HYD.DGTH,GENERAL,ADMINISTRATION,DGTH,MIN.AGRIC.ENV.RESS.HYD.,,
560862,MIN.EQUIP.HAB.AMEN.TERR.DIR.REG.EQUIP.HAB.AMEN.TERR.,GENERAL,ADMINISTRATION,DIR.REG.EQUIP.HAB.AMEN.TERR.,MIN.EQUIP.HAB.AMEN.TERR.,,
560872,MIN.AGRIC.ENV.RESS.HYD.DGTH PROJET BARBARA,GENERAL,ADMINISTRATION,DGTH PROJET BARBARA,MIN.AGRIC.ENV.RESS.HYD.,,
560882,MIN.EQUIP.HAB.AMEN.TERR.PROJET BAB SOUIKA HALFAOUINE,GENERAL,ADMINISTRATION,PROJET BAB SOUIKA HALFAOUINE,MIN.EQUIP.HAB.AMEN.TERR.,,
560891,MIN.EQUIP.HAB.AMEN.TERR.DIRECTION REGIONALE DE BEN AROUS,GENERAL,ADMINISTRATION,DIRECTION REGIONALE DE BEN AROUS,MIN.EQUIP.HAB.AMEN.TERR.,,
560902,MIN.EQUIP.HAB.AMEN.TERR.PROJET MAISON DES JEUNES,GENERAL,ADMINISTRATION,PROJET MAISON DES JEUNES,MIN.EQUIP.HAB.AMEN.TERR.,,
560912,MIN.EQUIP.HAB.AMEN.TERR.DGPC S/D AFF.GENERALES,GENERAL,ADMINISTRATION,DGPC S/D AFF.GENERALES,MIN.EQUIP.HAB.AMEN.TERR.,,
560922,MIN.EQUIP.HAB.AMEN.TERR.DIRECTION DE L'URBANISME,GENERAL,ADMINISTRATION,DIRECTION DE L'URBANISME,MIN.EQUIP.HAB.AMEN.TERR.,,
560932,MIN.EQUIP.HAB.AMEN.TERR.DGPC UNITE DE REALISATION DE L'AUTOROUTE,GENERAL,ADMINISTRATION,DGPC UNITE DE REALISATION DE L'AUTOROUTE,MIN.EQUIP.HAB.AMEN.TERR.,,
560942,MIN.EQUIP.HAB.AMEN.TERR.DIR.DE L'UNITE DE L'AMENAGEMENT DES ROUTES,GENERAL,ADMINISTRATION,DIR.DE L'UNITE DE L'AMENAGEMENT DES ROUTES,MIN.EQUIP.HAB.AMEN.TERR.,,
560952,MIN.AFF.FEM.FAM.ENF. OBSERVATOIR DES DROITS DE L'ENFANT,GENERAL,ADMINISTRATION,OBSERVATOIR DES DROITS DE L'ENFANT,MIN.AFF.FEM.FAM.ENF.,,
560962,MIN.AFF.JEUN.SPTS. OBSERVATOIRE NAT.DU SPORT,GENERAL,ADMINISTRATION,OBSERVATOIRE NAT.DU SPORT,MIN.JEUN.SPORTS EDUC.PHYS.,,
560972,MIN.ENS.SUP.RECH.SC.TECH. INSTITUT SUP.LANGUES APPLIQUEES ET INFORM.,GENERAL,ADMINISTRATION,INSTITUT SUP.LANGUES APPLIQUEES ET INFORM.,MIN.ENS.SUP.RECH.SC.,,
560982,MIN.ENS.SUP.RECH.SC.TECH. INSTITUT SUP.DES SC.TECHNOL.ET ENV.,GENERAL,ADMINISTRATION,INSTITUT SUP.DES SC.TECHNOL.ET ENV.,MIN.ENS.SUP.RECH.SC.,,
560992,PRESIDENCE DE LA REPUBLIQUE COMITE DES ELECTIONS PRESIDENTIELLES,GENERAL,ADMINISTRATION,COMITE DES ELECTIONS PRESIDENTIELLES,PREMIER MINISTERE,,
561012,MIN.AGRIC.ENV.RESS.HYD.REGIE DU MATERIEL DE TERRASSEMENT AGRICOLE,GENERAL,ADMINISTRATION,REGIE DU MATERIEL DE TERRASSEMENT AGRICOLE,MIN.AGRIC.ENV.RESS.HYD.,,
561022,MIN.AGRIC.ENV.RESS.HYD.DIR.GLE.PROD.AGRIC.,GENERAL,ADMINISTRATION,DIR.GLE.PROD.AGRIC.,MIN.AGRIC.ENV.RESS.HYD.,,
561032,MIN.AGRIC.ENV.RESS.HYD.DIR.GLE.DES BARRAGES - BARRAGE ABID -,GENERAL,ADMINISTRATION,DIR.GLE.DES BARRAGES - BARRAGE ABID -,MIN.AGRIC.ENV.RESS.HYD.,,
561042,MIN.AGRIC.ENV.RESS.HYD.PROJET DRI / GRN ( CRDA ZAGHOUAN ),GENERAL,ADMINISTRATION,PROJET DRI / GRN ( CRDA ZAGHOUAN ),MIN.AGRIC.ENV.RESS.HYD.,,
561052,MIN.AGRIC.ENV.RESS.HYD.PROJET DRI / GRN ( CRDA NABEUL ),GENERAL,ADMINISTRATION,PROJET DRI / GRN ( CRDA NABEUL ),MIN.AGRIC.ENV.RESS.HYD.,,
561062,MIN.AGRIC.ENV.RESS.HYD.AGENCE DE PROMOTION DES INVESTISSEMENTS AGR,GENERAL,ADMINISTRATION,AGENCE DE PROMOTION DES INVESTISSEMENTS AGR,MIN.AGRIC.ENV.RESS.HYD.,,
561072,MIN.AGRIC.ENV.RESS.HYD.C.R.D.A LA MANOUBA,GENERAL,ADMINISTRATION,C.R.D.A. DE LA MANOUBA,MIN.AGRIC.ENV.RESS.HYD.,,
561082,MIN.AGRIC.ENV.RESS.HYD.DIR.GLE.DU FINANCEMENT ET DES ENCOURAGEMENT,GENERAL,ADMINISTRATION,DIR.GLE.DU FINANCEMENT ET DES ENCOURAGEMENT,MIN.AGRIC.ENV.RESS.HYD.,,
561092,MIN.AGRIC.ENV.RESS.HYD.CENTRE DE FORM. PROF.AGRICOLE DE BEN AROUS,GENERAL,ADMINISTRATION,CENTRE DE FORM. PROF.AGRICOLE DE BEN AROUS,MIN.AGRIC.ENV.RESS.HYD.,,
561102,MIN.ENS.SUP.RECH.SC.TECH. INSTITUT SUPERIEUR BIOTECHNOLOGIE,GENERAL,ADMINISTRATION,INSTITUT SUPERIEUR BIOTECHNOLOGIE,MIN.ENS.SUP.RECH.SC.,,
561112,MIN.AGRIC.ENV.RESS.HYD.SCE.AMENAGEMENT LAC TUNIS,GENERAL,ADMINISTRATION,SCE.AMENAGEMENT LAC TUNIS,MIN.AGRIC.ENV.RESS.HYD.,,
561122,MIN.AGRIC.ENV.RESS.HYD.S/D ARROND.GRAND TVX.,GENERAL,ADMINISTRATION,S/D ARROND.GRAND TVX.,MIN.AGRIC.ENV.RESS.HYD.,,
561132,MIN.AGRIC.ENV.RESS.HYD.DIR.GENIE RURAL,GENERAL,ADMINISTRATION,DIR.GENIE RURAL,MIN.AGRIC.ENV.RESS.HYD.,,
561142,MIN.AFF.FEM.FAM.ENF. CENTRE INTEGRE JEUN.ENF.,GENERAL,ADMINISTRATION,CENTRE INTEGRE JEUN.ENF.,MIN.AFF.FEM.FAM.ENF.,,
561151,MIN.AGRIC.ENV.RESS.HYD.DIRECTION DE PRODUCTION AGRICOLE,GENERAL,ADMINISTRATION,DIRECTION DE PRODUCTION AGRICOLE,MIN.AGRIC.ENV.RESS.HYD.,,
561162,MIN.ENS.SUP.RECH.SC.TECH. ECOLE SUP.D'AUDIO-VISUELLE ET CINEMA,GENERAL,ADMINISTRATION,ECOLE SUP.D'AUDIO-VISUELLE ET CINEMA,MIN.ENS.SUP.RECH.SC.,,
561172,MIN.AGRIC.ENV.RESS.HYD.AFF.FONC.LEGISLATION,GENERAL,ADMINISTRATION,AFF.FONC.LEGISLATION,MIN.AGRIC.ENV.RESS.HYD.,,
561182,MIN.AGRIC.ENV.RESS.HYD.DIRECTION GLE.DE LA PECHE ET DE L'AQUACULTU,GENERAL,ADMINISTRATION,DIRECTION GLE.DE LA PECHE ET DE L'AQUACULTU,MIN.AGRIC.ENV.RESS.HYD.,,
561192,MIN.ENS.SUP.RECH.SC.TECH. RESTAURANT UNIV.HOUCINE EL JAZIRI,GENERAL,ADMINISTRATION,RESTAURANT UNIV.HOUCINE EL JAZIRI,MIN.ENS.SUP.RECH.SC.,,
561202,MIN.AGRIC.RESS.HYD.      INST.NAT. DES SC.ET TECHNOLOGIES DE MER.,GENERAL,ADMINISTRATION,MIN.AGRIC.RESS.HYD.      INST.NAT. DES SC.ET TECHNOLOGIES DE MER.,MIN.AGRIC.ENV.RESS.HYD.,,
561212,MIN.AGRIC.ENV.RESS.HYD.DIRECTIONS DES FORETS,GENERAL,ADMINISTRATION,DIRECTIONS DES FORETS,MIN.AGRIC.ENV.RESS.HYD.,,
561222,MIN.AGRIC.ENV.RESS.HYD.C.R.D.A DE NABEUL,GENERAL,ADMINISTRATION,C.R.D.A. DE NABEUL,MIN.AGRIC.ENV.RESS.HYD.,,
561232,MIN.INTER.DEV.LOC.COMMUNE SIDI HSINE,GENERAL,ADMINISTRATION,COMMUNE SIDI HSINE,MIN.INTER.DEV.LOC.,,
561242,MIN.AGRIC.ENV.RESS.HYD.OFFICE DES CEREALES,GENERAL,ADMINISTRATION,OFFICE DES CEREALES,MIN.AGRIC.ENV.RESS.HYD.,,
561252,MIN.AGRIC.ENV.RESS.HYD. INST.NAT.DE RECH.EN GENIE RURAL EAUX ET FO,GENERAL,ADMINISTRATION,INST.NAT.DE RECH.EN GENIE RURAL EAUX ET FO,MIN.AGRIC.ENV.RESS.HYD.,,
561262,MIN.EDUC.FORM. CENTRE REG.EDUC.FORM.CONTINUE,GENERAL,ADMINISTRATION,CENTRE REG.EDUC.FORM.CONTINUE,MIN.EDUC.,,
561272,MIN.ENS.SUP.RECH.SC.TECH. ECOLE SUP.DE COMMERCE ELECTRONIQUE,GENERAL,ADMINISTRATION,ECOLE SUP.DE COMMERCE ELECTRONIQUE,MIN.ENS.SUP.RECH.SC.,,
561282,MIN.JEUN.SPORTS EDUC.PHYS. CENTRE NAT.FORM.RECYC.CADRES JEUN.SPORTS ED,GENERAL,ADMINISTRATION,CENTRE NAT.FORM.RECYC.CADRES JEUN.SPORTS ED,MIN.JEUN.SPORTS EDUC.PHYS.,,
561292,MIN.AGRIC.ENV.RESS.HYD.ECOLE SUPERIEURE D'AGRICULTURE DE MOGRANE,GENERAL,ADMINISTRATION,ECOLE SUPERIEURE D'AGRICULTURE DE MOGRANE,MIN.AGRIC.ENV.RESS.HYD.,,
561302,MIN.AGRIC.ENV.RESS.HYD.INSTITUT NATIONAL AGRONOMIQUE DE TUNISIE,GENERAL,ADMINISTRATION,INSTITUT NATIONAL AGRONOMIQUE DE TUNISIE,MIN.AGRIC.ENV.RESS.HYD.,,
561312,MIN.AFF.FEM.FAM.ENF.CENTRE INTEGRE JEUN.ENF.,GENERAL,ADMINISTRATION,CENTRE INTEGRE JEUN.ENF.,MIN.AFF.FEM.FAM.ENF.,,
561322,MIN.ENS.SUP.RECH.SC.TECH.CENTRE RECH.TECHNOL.DES EAUX,GENERAL,ADMINISTRATION,CENTRE RECH.TECHNOL.DES EAUX,MIN.ENS.SUP.RECH.SC.,,
561332,MIN.AGRIC.ENV.RESS.HYD.LYCEE SECT.DE F.P.A. EN AGRUMICULTURE ET VI,GENERAL,ADMINISTRATION,LYCEE SECT.DE F.P.A. EN AGRUMICULTURE ET VI,MIN.AGRIC.ENV.RESS.HYD.,,
561342,MIN.ENS.SUP.RECH.SC.TECH.CENTRE DE BIOTECH.AU POLE TECH.BORJ CEDRIA,GENERAL,ADMINISTRATION,CENTRE DE BIOTECH.AU POLE TECH.BORJ CEDRIA,MIN.ENS.SUP.RECH.SC.,,
561352,MIN.ENS.SUP.RECH.SC.TECH.CITE UNIVERSITAIRE DE KORBA,GENERAL,ADMINISTRATION,CITE UNIVERSITAIRE DE KORBA,MIN.ENS.SUP.RECH.SC.,,
561362,MIN.AGRIC.ENV.RESS.HYD.CENTRE SECTORIEL DE FORM.PROF.EN MECANIQUE,GENERAL,ADMINISTRATION,CENTRE SECTORIEL DE FORM.PROF.EN MECANIQUE,MIN.AGRIC.ENV.RESS.HYD.,,
561372,MIN.AGRIC.ENV.RESS.HYD.INSTITUT DE RECHERCHE AGRONOMIQUE DE TUNISI,GENERAL,ADMINISTRATION,INSTITUT DE RECHERCHE AGRONOMIQUE DE TUNISIE,MIN.AGRIC.ENV.RESS.HYD.,,
561382,MIN.SPORTS MAISON DES JEUNES KORBA,GENERAL,ADMINISTRATION,MAISON DES JEUNES KORBA,MIN.JEUN.SPORTS EDUC.PHYS.,,
561392,MIN.EDUC.FORM.CENTRE SECTORIEL DE FOR PROFESS AGRICOLE EN,GENERAL,ADMINISTRATION,CENTRE SECTORIEL DE FOR PROFESS AGRICOLE EN,MIN.EDUC.,,
561402,MIN.INTER.DEV.LOC.OBSERVATOIR NAT.INFORM.FORM.DOC.ETU.SECUR.ROUT.,GENERAL,ADMINISTRATION,OBSERVATOIR NAT.INFORM.FORM.DOC.ETU.SECUR.ROUT.,MIN.INTER.DEV.LOC.,,
561412,MIN.AGRIC.ENV.RESS.HYD.DIVISION DES SOLS,GENERAL,ADMINISTRATION,DIVISION DES SOLS,MIN.AGRIC.ENV.RESS.HYD.,,
561422,MIN.ENS.SUP.RECH.SC.TECH.INSTITUT SUP.ETUDES APPL.EN HUMANITES,GENERAL,ADMINISTRATION,INSTITUT SUP.ETUDES APPL.EN HUMANITES,MIN.ENS.SUP.RECH.SC.,,
