NUMCPT,NOMCLI,TYPE_CLIENT,SECTEUR_CLIENT,CONSOLIDATION_CLIENT,CODAME,CODGVR,SERVICE_TYPE
249971,OMV TUNISIEN PRODUCTION GMBH SUCCURSAL,GENERAL,INDUSTRIE,OMV TUNISIEN PRODUCTION GMBH SUCCURSAL,EXTRAC.ET RAFFINAGE DE PETROLE ET PROD.GAZ,,
249981,SOCIETE KSIBI SERVICE INTERNATIONAL,GENERAL,INDUSTRIE,SOCIETE KSIBI SERVICE INTERNATIONAL,COMMERCE,,
259000,ATLAS MINERALS 009 RUE ANTAN TUNIS,GENERAL,INDUSTRIE,ATLAS MINERALS,AUTRES INDUSTRIES DIVERSES,,
259020,S O N E M EL M'GHIRA ZONE INDUSTRIELLE EL M'GHIRA TUNS,GENERAL,INDUSTRIE,S O N E M EL M'GHIRA,CONSERVERIES,,
259020,S O N E M EL M'GHIRA IMM HEINKEN RUE DU LAC LES BERGES DU LAC,GENERAL,INDUSTRIE,S O N E M EL M'GHIRA,CONSERVERIES,,
259060,STE MALLOULI DE TRAVAUX DE MAINTENANCE ROUTE DE GABES,GENERAL,INDUSTRIE,STE MALLOULI DE TRAVAUX DE MAINTENANCE,AUTRES INDUSTRIES DIVERSES,,
259070,GROUPE KOEING ET BAUER K . B . A MAGHREB RUE DU LAC WINDEMERE TUNIS,GENERAL,INDUSTRIE,GROUPE KOEING ET BAUER K . B . A MAGHREB,AUTRES INDUSTRIES DIVERSES,,
259080,MANUFACTURE DES ARTICLES EN CAOUTCHOU 034 FARHAT HACHED,GENERAL,INDUSTRIE,MANUFACTURE DES ARTICLES EN CAOUTCHOU,FABRI.DE PRODUIT EN MATIERE PLASTIQUE,,
259100,INDUSTRIE GENERALE DE PEINTURE ROUTE DE MATEUR KM 30 CHAOUAT ARIANA,GENERAL,INDUSTRIE,INDUSTRIE GENERALE DE PEINTURE,AUTRES INDUSTRIES CHIMIQUES,,
259120,SOCIETE MAGNOLIA PEINTURE SOUSSE NOUBELLE MEDINA BEN AROUS,GENERAL,INDUSTRIE,SOCIETE MAGNOLIA PEINTURE,COMMERCE,,
259150,SOCIETE TUNISIE BROSSE CARTHAGO ZONE INDUSTRIELLE POUDRIERE I,GENERAL,INDUSTRIE,SOCIETE TUNISIE BROSSE CARTHAGO,AUTRES INDUSTRIES DIVERSES,,
259160,SOCIETE LE PROGRES CHIMIQUE RUE DE L'NDUSTRIE ZI RADES,GENERAL,INDUSTRIE,SOCIETE LE PROGRES CHIMIQUE,COMMERCE,,
259170,ENTREPRISE BEN MABROUK AHMED JENHOURA KEBILI,GENERAL,INDUSTRIE,ENTREPRISE BEN MABROUK AHMED JENHOURA,BATIMENT ET TRAVAUX PUBLICS,,
259180,SOCIETE SOTEE SA 068 JAWHAR LEK NEHROU MONTFLEURY,GENERAL,INDUSTRIE,SOCIETE SOTEE SA,BATIMENT ET TRAVAUX PUBLICS,,
259200,COFICAB MED 040 RUE 18 JANVIER 1952 TUNIS RP,GENERAL,INDUSTRIE,COFICAB,AUTRES INDUSTRIES MECANIQUES + ELECTRIQUES,,
259220,M . P . C PROKIM INDUSTRIE RUE DU MERCURE BP 250 ZI BEN AROUS,GENERAL,INDUSTRIE,M.P.C PROKIM INDUSTRIE,AUTRES INDUSTRIES DIVERSES,,
259260,ENTREPRISE TOUX TRAVAUX DE BATIMENTS ZI KSAR SAID RUE 13002,GENERAL,INDUSTRIE,ENTREPRISE TOUX TRAVAUX DE BATIMENTS,BATIMENT ET TRAVAUX PUBLICS,,
259270,SOCIETE CRYO PROD AZOTE LIQUIDE 7 RUE ABDELHAMID IBN BADIS,GENERAL,INDUSTRIE,SOCIETE CRYO PROD AZOTE LIQUIDE,COMMERCE,,
259280,TECHNO PLAST CHARGUIA I 038 8600 CHARGUIA I ZI,GENERAL,INDUSTRIE,TECHNO PLAST,FABRI.DE PRODUIT EN MATIERE PLASTIQUE,,
200851,SAHBI BEN FREDJ SLAMA S/S AGIL PORT DE PECHE SOUSSE PORT DE PECHE DE SOUSSE,GENERAL,PORTS,PORT DE PECHE DE SOUSSE,PECHE,SOUSSE,
200861,MRS HABIB ET SAMIR B OTHMAN BEN MANSOUR GERANT S/S AGIL PORT PECHE CHEBBA,GENERAL,PORTS,PORT DE PECHE CHEBBA,PECHE,MAHDIA,
201241,BEN ROMDHANE FATMA GERANT S/S AGIL PORT PECHE KERKENAH,GENERAL,PORTS,PORT DE PECHE KERKENAH,PECHE,SFAX,
201371,SOCIETE MUTUELLE DE SERVICE DE PECHE EL KHALIJ GABES GERANT PORT PECHE 90 RUE HEDI CHAKER GABES,GENERAL,PORTS,PORT DE PECHE GABES,PECHE,GABES,
201541,MEMMI ABDELMAJID GERANT S/S AGIL PORT PLAISANCE EL KANTAOUI,GENERAL,PORTS,PORT DE PLAISANCE EL KANTAOUI,PECHE,SOUSSE,
202521,ALOUENE KHEMAIS BEN SALEM EL HOUIDA HZEG JBENIANA,GENERAL,PORTS,PORT DE PECHE JBENIANA,PECHE,SFAX,
202571,SOCIETE MUTUELLE BASE DES SERVICES DE PECHE ENNASR -GERANT P/PECHE- PORT DE PECHE DE TEBOULBA,GENERAL,PORTS,PORT DE PECHE TEBOULBA 1,PECHE,MONASTIR,
202581,HAJ JILANI BEN AHMED SALLEM LOUZA A,GENERAL,PORTS,PORT DE PECHE LOUZA,PECHE,SFAX,
203261,SOCIETE MUTUELLE DE SERVICE DE PECHE MARITIME - GOUVERNERAT MEDNINE - PORT DE PECHE EL KETF,GENERAL,PORTS,PORT DE PECHE EL KETF,PECHE,MEDNINE,
203321,MOHAMED BEN DHAOU TILIG GERANT S/S AGIL PORT PECHE BOUGRARA,GENERAL,PORTS,PORT DE PECHE BOUGRARA,PECHE,MEDNINE,
203451,SOCIETE MUTUELLE DE SERVICE DE PECHE MARITIME -GOUVERNERAT MEDNINE- PORT DE PECHE HOUMT SOUK,GENERAL,PORTS,PORT DE PECHE HOUMT SOUK,PECHE,MEDNINE,
203581,"MR MEHER BEN AHMED BEN AMOR MARNISSI""REVENDEUR CRIQUE"" RAS ENGELA HENCHIR EL GHIREN BIZERTE",GENERAL,PORTS,PORT DE PECHE  RAS ENGELA,PECHE,BIZERTE,
203691,SOCITE MUTUELLE DE BASE -SERVICES DE PECHE MAHDIA- PORT DE PECHE MAHDIA (BASSIN N`3),GENERAL,PORTS,PORT DE PECHE MAHDIA (SALAKTA),PECHE,MAHDIA,
205881,MOHSEN BEN DAOUD - GERANT PORT DE PECHE PORT DE PECHE SIDI DAOUD,GENERAL,PORTS,PORT DE PECHE SIDI DAOUD,PECHE,NABEUL,
205971,MOHAMED BEN M'RAD PORT DE PLAISANCE MONASTIR,GENERAL,PORTS,PORT DE PLAISANCE MONASTIR,PECHE,MONASTIR,
206191,COSOUP NOUVEAU PORT DE PECHE SFAX,GENERAL,PORTS,NOUVEAU PORT DE PECHE SFAX,PECHE,SFAX,
206192,COSOUP NOUVEAU PORT DE PECHE SFAX,GENERAL,PORTS,NOUVEAU PORT DE PECHE SFAX,PECHE,SFAX,
206381,SOCIETE BIZERTE CAP 3000,GENERAL,PORTS,PORT DE PLAISANCE BIZERTE,PECHE,BIZERTE,
206711,BARKAOUI FETHI GERANT S/S AGIL PORT DE PECHE GOULETTE 28 AV HABIB BOURGUIBA MEGRINE,GENERAL,PORTS,PORT DE PECHE GOULETTE,PECHE,TUNIS,
206871,SOCIETE MUTUELLE DE SERVICE DE PECHE EL KHALI GERANT PORT PECHE 90 RUE HEDI CHAKER GABES,GENERAL,PORTS,PORT DE PECHE GABES,PECHE,GABES,
206881,SOCIETE MUTUELLE DE SERVICE DE PECHE MARITIME -GOUVERNERAT MEDNINE- PORT DE PECHE ZARZIS,GENERAL,PORTS,PORT DE PECHE ZARZIS,PECHE,MEDNINE,
206891,COOPERATIVE DES SERVICES MARITIMES ESSALEM - GERANT PORT DE PECHE PORT DE PECHE SAYADA,GENERAL,PORTS,PORT DE PECHE SAYADA,PECHE,MONASTIR,
206901,SOCIETE YASMINE AUX SERVICES DE LA PECHE PORT DE PECHE KELIBIA,GENERAL,PORTS,PORT DE PECHE KELIBIA 1,PECHE,NABEUL,
206921,COOPERATIVE REGIONALE DE PECHE PORT DE PECHE MONASTIR,GENERAL,PORTS,PORT DE PECHE MONASTIR,PECHE,MONASTIR,
206971,DHOUIB HECHMI - GERANT PORT DE PECHE MAHDIA PORT DE PECHE MAHDIA,GENERAL,PORTS,PORT DE PECHE MAHDIA,PECHE,MAHDIA,
207011,MR HABIB BEN HASSEN HACHED - GERANT PORT DE PECHE PORT DE PECHE ZARZOUNA - RIVE DROITE,GENERAL,PORTS,PORT DE PECHE ZARZOUNA - RIVE DROITE,PECHE,BIZERTE,
207151,JILANI BEN AHMED SALLEM GERANT S/S AGIL PORT PECHE LOUZA,GENERAL,PORTS,PORT DE PECHE LOUZA,PECHE,SFAX,
207181,"SOCIETE MUTUELLE PRINCIPALE DE PECHE ""COPEB"" PORT DE BENI KHIAR",GENERAL,PORTS,PORT DE PECHE BENI KHIAR,PECHE,NABEUL,
207301,COSOUP PORT EL ATAYA KERKENAH NOUVEAU PORT DE PECHE DE SFAX,GENERAL,PORTS,PORT DE PECHE EL ATAYA KERKENAH,PECHE,SFAX,
207941,SOCIETE MUTUELLE DE BASE DES SERVICES DES PECHES - ZARZIS - EL GRINE - SIDI MAKHLOUF - MEDNINE,GENERAL,PORTS,PORT DE PECHE EL GRINE,PECHE,MEDNINE,
208452,SOCIETE MUTUELLE CENTRALE DE SERVICE AGRICOLE MOTOCOP RUE DE GUINEE N024 TUNIS BELVEDERE,GENERAL,PORTS,PORT DE PECHE SFAX,PECHE,SFAX,
210141,MELLE MABROUKA BENT JILANI SALLAM GERANTE P/P LOUZA PORT DE PECHE LOUZA,GENERAL,PORTS,PORT DE PECHE LOUZA,PECHE,SFAX,
210681,MEHDI BEN BRAHIM MAIZ (GERANT S/S AGIL P/PECHE GHAR EL MELH) PORT DE PECHE GHAR EL MELH,GENERAL,PORTS,PORT DE PECHE GHAR EL MELH,PECHE,BIZERTE,
210691,MR SAADALLAH EL KSOURI GERANT S/S AGIL P/PECHE K.EL ANDALOUS,GENERAL,PORTS,PORT DE PECHE KALAAT EL ANDALOUS,PECHE,ARIANA,
210771,MR AZAIEZ KILANI BOUCETTA GERANT S/S AGIL PORT PECHE ZARZOUNA,GENERAL,PORTS,PORT DE PECHE ZARZOUNA,PECHE,BIZERTE,
210781,MR RABEH BRAHIM BEN AMMAR BEN SALEM RTE MAHDIA KM 19 CENTRE MED LACHHEB SFAX,GENERAL,PORTS,PORT DE PECHE EL AWABED,PECHE,SFAX,
210791,MR BAHRI BEN CHAABENE BOUSSADIA GERANT S/S AGIL PORT PECHE HERGLA,GENERAL,PORTS,PORT DE PECHE HERGLA,PECHE,SOUSSE,
211021,NOUREDDINE BEN AMEUR EL ABASSI GERANT S/S AGIL PORT DE PECHE SIDI MECHREG,GENERAL,PORTS,PORT DE PECHE SIDI MECHREG,PECHE,BIZERTE,
211421,MME HAYFA NOUIRA -GERANTE S/S AGIL P/PECHE TEBOULBA- PORT DE PECHE TEBOULBA,GENERAL,PORTS,PORT DE PECHE TEBOULBA 2,PECHE,MONASTIR,
213521,SOCIETE ELLOUMI FRERES NOUVEAU PORT DE PECHE BLOC 5 N0 15 SFAX,GENERAL,PORTS,NOUVEAU PORT DE PECHE SFAX,PECHE,SFAX,
213901,NOUVEAU PORT DE PECHE SFAX,GENERAL,PORTS,NOUVEAU PORT DE PECHE SFAX,PECHE,SFAX,
214091,MR RIADH BEN MOKHTAR GONDECHE - GERANT PORT DE PECHE PORT DE PECHE CHAT EL MACHANI KERKENAH,GENERAL,PORTS,PORT DE PECHE EL MACHANI KERKENAH,PECHE,SFAX,
214321,SOCIETE MUTUELLE DES SERVICES DES PECHE PORT DE PECHE TABARKA,GENERAL,PORTS,PORT DE PECHE TABARKA,PECHE,JENDOUBA,
214361,SOCIETE MUTUELLE DE SERVICES DE PECHE MARITIME - GOUVERNERAT MEDNINE-_ PORT DE PECHE ZARZIS,GENERAL,PORTS,PORT DE PECHE ZARZIS,PECHE,MEDNINE,
214741,MR MOHSEN BEN SOUISSI BEN DAOUED - GERANT PORT DE PECHE PORT DE PECHE EL HAOUARIA,GENERAL,PORTS,PORT DE PECHE EL HAOUARIA,PECHE,NABEUL,
215391,HLIOUI HAFEDH GERANT S/S AGIL PORT PECHE EL KRATEN KERKENAH EL KRATEN KERKENAH,GENERAL,PORTS,PORT DE PECHE EL KRATEN KERKENAH,PECHE,SFAX,
215561,ABDELFATTAH BEN MED NASR GERANT S/S AGIL P/PECHE SKHIRA BASSIN N 2 PORT PECHE LA SKHIRA,GENERAL,PORTS,PORT DE PECHE LA SKHIRA,PECHE,SFAX,
216371,COMPTOIR REGIONAL DES PECHES DU GOUVERNERAT DE MEDNINE PORT DE PECHE ZARZIS,GENERAL,PORTS,PORT DE PECHE ZARZIS,PECHE,MEDNINE,
216411,MR.JOUINI AHMED BEN SAID PORT DE PECHE ZABOUSSA - EL GHREIBA,GENERAL,PORTS,PORT DE PECHE ZABOUSSA,PECHE,SFAX,
218401,MME RAKIA BEN NOUREDDINE GUELAOUI GERANT S/S AGIL P/PECHE ZARZOUNA RIVE-GAUCHE,GENERAL,PORTS,PORT DE PECHE ZARZOUNA - RIVE GAUCHE,PECHE,BIZERTE,
218551,MR KAMEL BOUAFOURA - GERANT PORT DE PECHE PORT DE PECHE CAP ZEBIB,GENERAL,PORTS,PORT DE PECHE CAP ZEBIB,PECHE,BIZERTE,
218751,SOCIETE SOCOLA PORT DE PECHE KELIBIA,GENERAL,PORTS,PORT DE PECHE KELIBIA 2,PECHE,NABEUL,
220771,"STE AGIL DE GESTION""SAGES"" GERANT PORT PLAISANCE SIDI BOUSAID AV.MED ALI AKID CITE OLYMPIQUE",GENERAL,PORTS,PORT PLAISANCE SIDI BOUSAID,PECHE,TUNIS,
221661,KAMEL BEN YOUSSEF BEN MOUSSA ERRCHARCHA KSOUR ESSAF,GENERAL,PORTS,PORT DE PECHE KSOUR ESSAF,PECHE,MAHDIA,
221871,MR NAJEH BEN HABIB FREDJ - GERANT PORT DE PECHE PORT DE PECHE EL MAHRES,GENERAL,PORTS,PORT DE PECHE EL MAHRES,PECHE,SFAX,
221951,WALID BEN MOHAMED BEN FREDJ - GERANT PORT DE PECHE PORT DE PECHE MENZEL ABDERRAHMEN,GENERAL,PORTS,PORT DE PECHE MENZEL ABDERRAHMEN,PECHE,BIZERTE,
222761,KHALED BEN EL HEDI BEN ALI ACHOUR - GERANT PORT DE PECHE PORT DE PECHE BEKALTA,GENERAL,PORTS,PORT DE PECHE BEKALTA,PECHE,MONASTIR,
223431,COOPERATIVE DES PECHES EL KHALIJ 90 RUE HEDI CHAKER,GENERAL,PORTS,PORT DE PECHE ZARRAT,PECHE,GABES,
224851,MR SAIF ALLAH KECHICHE GERANT S/S AGIL P/PECHE HERGLA,GENERAL,PORTS,PORT DE PECHE HERGLA,PECHE,SOUSSE,
226131,FREJ SALLEM PORT EL LOUZA LOUATA,GENERAL,PORTS,PORT DE PECHE LOUZA,PECHE,SFAX,
228541,EL KHANCHOUCH MOHSEN BEN KACEM BEN ROMDHANE PORT DE PECHE AJIM DJERBA,GENERAL,PORTS,PORT DE PECHE AJIM DJERBA,PECHE,MEDNINE,
242320,MR NIZAR BEN SALAH B.MED ESSAHLI GERANT S/S AGIL PORT DE PECHE KALAAT ANDALOUS,GENERAL,PORTS,PORT DE PECHE KALAAT EL ANDALOUS,PECHE,ARIANA,
242430,S A G E S GERANT -PROVISOIR- DU PORT DE PLAISANCE MARINA MONASTIR AV. MED. ALI AKID CITE OLYMPIQUE TUNIS,GENERAL,PORTS,PORT DE PLAISANCE MONASTIR,PECHE,MONASTIR,
244540,MOHAMED BEN KEFI SAKHRI GERANT S/S AGIL PORT PLAISANCE HAMMAMET SUD PORT PLAISANCE HAMMAMET SUD,GENERAL,PORTS,PORT PLAISANCE HAMMAMET SUD,PECHE,NABEUL,
244610,MR NIZAR BEN CHAFIK BEN YOUSSEF GERANT S/S AGIL PORT DE PECHE KSIBET MEDIOUNI,GENERAL,PORTS,PORT DE PECHE KSIBET MEDIOUNI,PECHE,MONASTIR,
223861,GURICHI MOHAMED B ABDELHAFIDH REVENDEUR EL OUSLATIA ALI BELHOUANE,GENERAL,REVENDEUR,GURICHI MOHAMED B ABDELHAFIDH REVENDEUR,COMMERCE,,
224131,LANDOLSI TAOUFIK REVENDEUR EL ALIA ROUTE KHETMINE EL ALIA,GENERAL,REVENDEUR,LANDOLSI TAOUFIK REVENDEUR,COMMERCE,,
203841,CHEHERLI ABDELBAKI REVENDEUR ALI BEN GHEDAHEM KELIBIA,GENERAL,S/ LAVAGE,CHEHERLI ABDELBAKI REVENDEUR,COMMERCE,KELIBIA,
206461,NAIMA HAWARI SALLE DE LAVAGE MORNAGUIA KM 13 RUE DE BEJA MORNAGUIA MANNOUBA,GENERAL,S/ LAVAGE,NAIMA HAWARI SALLE DE LAVAGE,COMMERCE,MANOUBA,
206941,FERJAOUI MAROUA SALLE DE LAVAGE BORJ LOUZIR RUE N° 14 KORBA BORJ LOUZIR ARIANA,GENERAL,S/ LAVAGE,FERJAOUI MAROUA SALLE DE LAVAGE,COMMERCE,ARIANA,
209421,MANAI SAMI B AMARA B MUSTAPHA S/LAVAGE JENDOUBA Z.I. JENDOUBA,GENERAL,S/ LAVAGE,MANAI SAMI B AMARA B MUSTAPHA S/LAVAGE,COMMERCE,JENDOUBA,
210001,MALLOULI ZOUHEIR LOCATION DES ENGINS 007 ROUTE GABES KM 1.5 SFAX,GENERAL,S/ LAVAGE,MALLOULI ZOUHEIR LOCATION DES ENGINS,COMMERCE,SFAX,
210191,AZOUZ BOUDAYA REVENDEUR RUE HAMDA ISSAOUI N 13 KALAAT LENDALOUS,GENERAL,S/ LAVAGE,AZOUZ BOUDAYA REVENDEUR,COMMERCE,,
210611,SAHAR BENT HAJ MAHMOUD SALLE DE LAVAGE BOUMERDAS RUE EL KODES BOUMERDAS MAHDIA,GENERAL,S/ LAVAGE,SAHAR BENT HAJ MAHMOUD SALLE DE LAVAGE,COMMERCE,MAHDIA,
214051,STATION VIDANGE GRAISSAGE AUTOMOBILES - BEN LAGHA HABIB BD 7 NOVEMBRE 1987 BIZERTE,GENERAL,S/ LAVAGE,STATION VIDANGE GRAISSAGE AUTOMOBILES,COMMERCE,BIZERTE,
218651,ULYSSE HYPER DISTRIBUTION CROISEMENT R9/R10 DIDI DAOUD,GENERAL,S/ LAVAGE,ULYSSE HYPER DISTRIBUTION,COMMERCE,TUNIS,
221941,"STE MUSTI EQUIPEMENT "" DISTRIBUTEUR LUBRIFIANTS"" RUE HABIB BOURGUIBA EL KRIB",GENERAL,S/ LAVAGE,"STE MUSTI EQUIPEMENT "" DISTRIBUTEUR LUBRIFIANTS""",COMMERCE,SILIANA,
222231,"BOUMAISA SERVICES "" EL IMTIEEZ "" AV HB BOURGUIBA 127 MENZEL BOUZELFA NABEUL",GENERAL,S/ LAVAGE,"BOUMAISA SERVICES "" EL IMTIEEZ """,COMMERCE,NABEUL,
222551,AUTO SERVICE MIDOU SALLE DE LAVAGE ARIANA,GENERAL,S/ LAVAGE,AUTO SERVICE MIDOU SALLE DE LAVAGE,COMMERCE,ARIANA,
222611,"SALLE DE LAVAGE ABDALLAH HAZZAMI "" ARIANA "" KM 05 ROUTE DE RAOUED",GENERAL,S/ LAVAGE,"SALLE DE LAVAGE ABDALLAH HAZZAMI "" ARIANA """,COMMERCE,ARIANA,
223171,MOHAMED CHERIF SALLE DE LAVAGE AUTOROUTE DE BIZERTE GP8 ROUTE DE BIZERTE ARIANA,GENERAL,S/ LAVAGE,MOHAMED CHERIF SALLE DE LAVAGE,COMMERCE,ARIANA,
223181,MAHMOUD BEN AHMED HASNI REVENDEUR CITE DE PRESIDENT Z.I METLAOUI GAFSA,GENERAL,S/ LAVAGE,MAHMOUD BEN AHMED HASNI REVENDEUR,COMMERCE,GAFSA,
223441,SOCIETE GENERALE AUTO SUD REVENDEUR METLAOUI METLAOUI CITE DU PRESIDENT,GENERAL,S/ LAVAGE,SOCIETE GENERALE AUTO SUD REVENDEUR,COMMERCE,GAFSA,
223471,JAMEL EDDINE GOUADER REVENDEUR GAFSA KSAR GAFSA,GENERAL,S/ LAVAGE,JAMEL EDDINE GOUADER REVENDEUR,COMMERCE,GAFSA,
223481,FAKHFAKH MAHMOUD RUE MAURITANIE IMM JERBI SFAX,GENERAL,S/ LAVAGE,FAKHFAKH MAHMOUD,COMMERCE,SFAX,
223651,SOCIETE NECESSAIRE INDUSTRIE AV ALGERIE RUE IBN BADIS PRES DE LA SONEDE,GENERAL,S/ LAVAGE,SOCIETE NECESSAIRE INDUSTRIE,COMMERCE,TUNIS,
223711,AOUINI MOHAMED SALLE DE LAVAGE ELECTRO MOUSSE KM 13 RUE DE BEJA MORNAGUIA,GENERAL,S/ LAVAGE,AOUINI MOHAMED SALLE DE LAVAGE,COMMERCE,MANOUBA,
223731,OUALID BEN MEHREZ QUAINCAILLERIE KALAAT EL ANDALOUS AV 7 NOV KALAAT EL ANDALOUS,GENERAL,S/ LAVAGE,OUALID BEN MEHREZ QUAINCAILLERIE,COMMERCE,,
223801,MONGI BOUROUIS SALLE DE LAVAGE YASSMINET 1 RUE IBN RACHIK YASSMINET,GENERAL,S/ LAVAGE,MONGI BOUROUIS SALLE DE LAVAGE,COMMERCE,,
223961,GUERMAZI EL WAZNA BT BOUBAKER B MOHAMED,GENERAL,S/ LAVAGE,GUERMAZI EL WAZNA BT BOUBAKER B MOHAMED,COMMERCE,,
224001,S . A . G . E . S SA AGIL DE GESTION ET DE SERVICES AV MOHAMED ALI AKID CITE OLYMPIQUE EL KHADHRA TUNIS,GENERAL,S/ LAVAGE,S . A . G . E . S SA AGIL DE GESTION ET DE SERVICES,COMMERCE,TUNIS,
224041,SOCIETE S. D. H. M . D ( LA SFAXIENN DE DISTR DES HUILES POUR MOTEUR N° 15 RUE 13 AOUT GAGARINE S 1 SFAX,GENERAL,S/ LAVAGE,SOCIETE S. D. H. M . D,COMMERCE,SFAX,
224351,GOLD FILTRES REVENDEUR TEBOURBA ROUTE CHOUIGUI TEBOURBA,GENERAL,S/ LAVAGE,GOLD FILTRES REVENDEUR,COMMERCE,,
224461,GHZAL JAMEL EDDINE REVENDEUR SFAX ROUTE DE GABES KM 1 SFAX,GENERAL,S/ LAVAGE,GHZAL JAMEL EDDINE REVENDEUR,COMMERCE,SFAX,
224971,MEHDI EL JAZIRI SALLE DE LAVAGE KALAAT EL ANDALOUS AV HABIB BOURGUIBA KALAAT EL ANDALOUS,GENERAL,S/ LAVAGE,MEHDI EL JAZIRI SALLE DE LAVAGE,COMMERCE,,
225391,WAHIDA BENT ROMDHANE LOUATI REVENDEUR MEDJEZ EL BAB CITE DE LA SANTE MEDJEZ EL BAB,GENERAL,S/ LAVAGE,WAHIDA BENT ROMDHANE LOUATI REVENDEUR,COMMERCE,BEJA,
225421,HAZARI EZZEDDINE SALLE DE LAVAGE EL KEF 5 ROUTE GP5 LE KEF,GENERAL,S/ LAVAGE,HAZARI EZZEDDINE SALLE DE LAVAGE,COMMERCE,LE KEF,
226871,GHANEM MONEEM CITE OUELI BD 7 NOVEMBRE BIZERTE,GENERAL,S/ LAVAGE,GHANEM MONEEM CITE OUELI,COMMERCE,BIZERTE,
227321,ETABLISSEMENT MOHAMED KAMEL SADOK ROBBANA ET COMPAGNIES HASSEN NOURI MENZEL BOURGUIBA,GENERAL,S/ LAVAGE,ETABLISSEMENT MOHAMED KAMEL SADOK ROBBANA ET COMPAGNIES,COMMERCE,,
227611,STE GRAPHIKA 7 RUE DES METIERS Z.I CHARGUIA II,GENERAL,S/ LAVAGE,STE GRAPHIKA,COMMERCE,,
228441,SOCIETE ABID DE DISTRIBUTION DES LUBRIFIANTS ROUTE MONASTIR KM5 SIDI ABDEL HAMID SOUSSE,GENERAL,S/ LAVAGE,SOCIETE ABID DE DISTRIBUTION DES LUBRIFIANTS,COMMERCE,SOUSSE,
228501,GADDOUR BEN MAHMOUD DALHOUMI DISTRIBUTEUR AGIL EL KASSERINE ABENUE HABIB BOURGUIBA KASSERINE,GENERAL,S/ LAVAGE,GADDOUR BEN MAHMOUD DALHOUMI DISTRIBUTEUR,COMMERCE,KASSERINE,
228801,MAALEG HAFFEDH REVENDEUR SFAX ROUTE DE TUNIS KM 6 SAKIET EZZIT,GENERAL,S/ LAVAGE,MAALEG HAFFEDH REVENDEUR,COMMERCE,SFAX,
228821,KHABTHANI FRAJ BEN KHALIFA REVENDEUR CHOBRANE RUE DE LA REPUBLIQUE CHOBRANE,GENERAL,S/ LAVAGE,KHABTHANI FRAJ BEN KHALIFA REVENDEUR,COMMERCE,,
228941,GHRIBI AMMAR REVENDEUR EL HAMMA AV HABIB BOURGUIBA EL HAMMA N0 157,GENERAL,S/ LAVAGE,GHRIBI AMMAR REVENDEUR,COMMERCE,,
229351,"SOCIETE CODULIP DISTRIBUTEUR LUBES ROUTE MHARZA KM 2,5 SFAX SUD",GENERAL,S/ LAVAGE,SOCIETE CODULIP DISTRIBUTEUR LUBES,COMMERCE,SFAX,
229501,FAKHFAKH BECHIR REVENDEUR ENNKHILET ARIANA 086 FATHI ZOUHAIER ENNKHILET,GENERAL,S/ LAVAGE,FAKHFAKH BECHIR REVENDEUR,COMMERCE,,
229891,STE DE PROTECTION ET PRESTATION SERVICE S.P.P.S AV 5 AOUT RUE IBNRACHIK N1 SFAX,GENERAL,S/ LAVAGE,STE DE PROTECTION ET PRESTATION SERVICE S.P.P.S,COMMERCE,SFAX,
240281,MOHAMED BEN MONCEF HAANBA SALLE DE LAVAGE TEBOURSOUK ROUTE GP5 TEBOURSOUK,GENERAL,S/ LAVAGE,MOHAMED BEN MONCEF HAANBA SALLE DE LAVAGE,COMMERCE,,
240491,JALEL CHATEUR REVENDEUR BENI KHALLED ROUTE DE KORBA BENI KHALLED,GENERAL,S/ LAVAGE,JALEL CHATEUR REVENDEUR,COMMERCE,NABEUL,
240621,SOCIETE REINE RENT A CAR REVENDEUR RUE TAIEB SARDOUK KELIBIA,GENERAL,S/ LAVAGE,SOCIETE REINE RENT A CAR REVENDEUR,COMMERCE,KELIBIA,
240851,TAREK HAZARI SALLE DE LAVAGE LE KEF CITE TAIEB M'HIRI LE KEF,GENERAL,S/ LAVAGE,TAREK HAZARI SALLE DE LAVAGE,COMMERCE,LE KEF,
240941,BEL HAJ JAMILA SALLE LAVAGE EL HAOUARIA GHARMEN SAHEB JEBEL,GENERAL,S/ LAVAGE,BEL HAJ JAMILA SALLE LAVAGE,COMMERCE,,
240951,OUNI MOHAMED REVENDEUR ABDELAZIZ THAALBI M'HAMDIA,GENERAL,S/ LAVAGE,OUNI MOHAMED REVENDEUR,COMMERCE,,
240961,HAMDI GUEZMIR SALLE DE LAVAGE KALAAT EL ANDALOUS RUE MONADHILINE KALAAT EL ANDALOUS,GENERAL,S/ LAVAGE,HAMDI GUEZMIR SALLE DE LAVAGE,COMMERCE,,
241041,SOCIETE MEDITERRANEE DE LUBRIFIANTS AV HABIB BOURGUIBA BOUFICHA SOUSSE,GENERAL,S/ LAVAGE,SOCIETE MEDITERRANEE DE LUBRIFIANTS,COMMERCE,,
241051,MOUNIR LAHDHIRI SALLE DE LAVAGE AMEL 114 IBN EL JAZAR BHAR LAZEREK LA MARSA,GENERAL,S/ LAVAGE,MOUNIR LAHDHIRI SALLE DE LAVAGE,COMMERCE,,
241101,ZOGHLAMI CHAOUKI BEN AMMAR REVENDEUR RUE LA MEQUE SAKIET SIDI YOUSSEF,GENERAL,S/ LAVAGE,ZOGHLAMI CHAOUKI BEN AMMAR REVENDEUR,COMMERCE,,
245370,FATHI GZARA SALLE DE LAVAGE JAMMAL STATION SERVICE AGIL JAMMAL,GENERAL,S/ LAVAGE,FATHI GZARA SALLE DE LAVAGE,COMMERCE,,
245410,SOCIETE VITESSE RUE ABDERRAHMAN MAMI RES HASSNA BORJ LOUZIR,GENERAL,S/ LAVAGE,SOCIETE VITESSE,COMMERCE,ARIANA,
245490,NAJAH CHAABANE REVENDEUR PIECES DETACHEES RUE LYBIE KHENIS MONASTIR,GENERAL,S/ LAVAGE,NAJAH CHAABANE REVENDEUR,COMMERCE,,
245540,LUBRIFIANT GENERAL PIECES MECANIQUES 28 AVENUE D'ALGERIE SFAX,GENERAL,S/ LAVAGE,LUBRIFIANT GENERAL PIECES MECANIQUES,COMMERCE,,
245560,OUESLATI ANIS REVENDEUR MHAMDIA AVENUE 7 NOVEMBRE MHAMDIA,GENERAL,S/ LAVAGE,OUESLATI ANIS REVENDEUR,COMMERCE,,
249901,ABDELMAKSOUD IMED 7 RUE CARTHAGE TATAOUINE,GENERAL,S/ LAVAGE,ABDELMAKSOUD IMED,COMMERCE,,
259130,HSSAN BEN YOUSSEF DJEBI SALLE DE LAVAGE THIBAR CITE DES OUVRIERS BEJA,GENERAL,S/ LAVAGE,HSSAN BEN YOUSSEF DJEBI SALLE DE LAVAGE,COMMERCE,,
259250,NIZAR BEN AHMED SAHLI REVENDEUR AV L ENVIRONNEMENT MENZEL TEMIME,GENERAL,S/ LAVAGE,NIZAR BEN AHMED SAHLI REVENDEUR,COMMERCE,,
200581,"GHRISSI TRANSPORT SERVICES ""GTS"" ROUTE DE GABES KM 6,5 SFAX",GENERAL,TRANSPORT,"GHRISSI TRANSPORT SERVICES ""GTS""",TRANSPORT ROUTIER MARCHANDISE,,
201741,T R A P S A 118 AV. DE LA LIBERTE TUNIS,GENERAL,TRANSPORT,T R A P S A,TRANSPORT PAR OLEODUC ET GAZODUC,,
201742,T R A P S A 118 AV. DE LA LIBERTE TUNIS,GENERAL,TRANSPORT,T R A P S A,TRANSPORT PAR OLEODUC ET GAZODUC,,
201791,T R A P S A LA SKHIRA -SFAX-,GENERAL,TRANSPORT,T R A P S A,TRANSPORT PAR OLEODUC ET GAZODUC,,
201801,"STE REGIONALE DE TRANSPORT DU GOUVERNERAT DE BEJA ""S.R.T.B"" 6 AVENUE DE L'ENVIRONNEMENT - BEJA -",GENERAL,TRANSPORT,"STE REGIONALE DE TRANSPORT DU GOUVERNERAT DE BEJA ""S.R.T.B""",TRANSPORT ROUTIER PARTICULIER (NON MARCH.),,
201801,"STE REGIONALE DE TRANSPORT DU GOUVERNERAT DE BEJA ""S.R.T.B"" 6 AVENUE HABIB BOURGUIBA BEJA",GENERAL,TRANSPORT,"STE REGIONALE DE TRANSPORT DU GOUVERNERAT DE BEJA ""S.R.T.B""",TRANSPORT ROUTIER PARTICULIER (NON MARCH.),,
201802,"STE REGIONALE DE TRANSPORT DU GOUVERNERAT DE BEJA ""S.R.T.B"" 6 AVENUE DE L'ENVIRONNEMENT - BEJA -",GENERAL,TRANSPORT,"STE REGIONALE DE TRANSPORT DU GOUVERNERAT DE BEJA ""S.R.T.B""",TRANSPORT ROUTIER PARTICULIER (NON MARCH.),,
201802,"STE REGIONALE DE TRANSPORT DU GOUVERNERAT DE BEJA ""S.R.T.B"" 6 AVENUE HABIB BOURGUIBA BEJA",GENERAL,TRANSPORT,"STE REGIONALE DE TRANSPORT DU GOUVERNERAT DE BEJA ""S.R.T.B""",TRANSPORT ROUTIER PARTICULIER (NON MARCH.),,
201831,"SOCIETE DES TRANSPORTS DE TUNIS ""STT"" 33 AVENUE DU JAPON MONTPLAISIR TUNIS",GENERAL,TRANSPORT,"SOCIETE DES TRANSPORTS DE TUNIS ""STT""",TRANSPORT ROUTIER PARTICULIER (NON MARCH.),,
201831,"SOCIETE DES TRANSPORTS DE TUNIS ""T R A N S T U "" 33 AVENUE DU JAPON MONTPLAISIR TUNIS",GENERAL,TRANSPORT,"SOCIETE DES TRANSPORTS DE TUNIS ""T R A N S T U """,TRANSPORT ROUTIER PARTICULIER (NON MARCH.),,
201832,"SOCIETE DES TRANSPORTS DE TUNIS ""STT"" 33 AVENUE DU JAPON MONTPLAISIR TUNIS",GENERAL,TRANSPORT,"SOCIETE DES TRANSPORTS DE TUNIS ""STT""",TRANSPORT ROUTIER PARTICULIER (NON MARCH.),,
201832,"SOCIETE DES TRANSPORTS DE TUNIS ""T R A N S T U "" 33 AVENUE DU JAPON MONTPLAISIR TUNIS",GENERAL,TRANSPORT,"SOCIETE DES TRANSPORTS DE TUNIS ""T R A N S T U """,TRANSPORT ROUTIER PARTICULIER (NON MARCH.),,
201871,STE REGIONALE DE TRANSPORT VOYAGEURS DE JENDOUBA BD 9 AVRIL 1938 JENDOUBA,GENERAL,TRANSPORT,STE REGIONALE DE TRANSPORT VOYAGEURS DE JENDOUBA,TRANSPORT ROUTIER PARTICULIER (NON MARCH.),,
201872,STE REGIONALE DE TRANSPORT VOYAGEURS DE JENDOUBA BD 9 AVRIL 1938 JENDOUBA,GENERAL,TRANSPORT,STE REGIONALE DE TRANSPORT VOYAGEURS DE JENDOUBA,TRANSPORT ROUTIER PARTICULIER (NON MARCH.),,
202051,SOUTAGE INTERNATIONAL TUNISIE RP,GENERAL,TRANSPORT,SOUTAGE INTERNATIONAL TUNISIE RP,TRANSPORT MARITIME BUNKERS,,
202131,"SOCIETE NOUVELLE DE TRANSPORT KERKENNAH ""S O N O T R A K "" RUE A.DUMAS SFAX",GENERAL,TRANSPORT,"SOCIETE NOUVELLE DE TRANSPORT KERKENNAH ""S O N O T R A K """,TRANSPORT ROUTIER MARCHANDISE,,
202331,STE TRANSPORT MARCHANDISES DU SAHEL Z .I SIDI ABDELHAMID BP336 SOUSSE,GENERAL,TRANSPORT,STE TRANSPORT MARCHANDISES DU SAHEL,TRANSPORT ROUTIER MARCHANDISE,,
202691,"TRANSPORT INTERNATIONAL ROUTIER ""TIR VEGA"" ZONE INDUSTRIELLE RADES BP 823",GENERAL,TRANSPORT,"TRANSPORT INTERNATIONAL ROUTIER ""TIR VEGA""",TRANSPORT ROUTIER MARCHANDISE,,
203151,BUNKER ENERGY SPA VIA B. BOSCO 57-7B 16121 GENOVA ITALIE,GENERAL,TRANSPORT,BUNKER ENERGY SPA,TRANSPORT MARITIME BUNKERS,,
203231,"COMPTOIR TUNISIEN DE TRANSPORT MARCHANDISES ""CTTM "" GP1 KM 12 EZZAHRA",GENERAL,TRANSPORT,"COMPTOIR TUNISIEN DE TRANSPORT MARCHANDISES ""CTTM """,TRANSPORT ROUTIER MARCHANDISE,,
203601,S O T R A P I L BLUD DE LA TERRE CENTRE URBAIN NORD,GENERAL,TRANSPORT,S O T R A P I L,TRANSPORT PAR OLEODUC ET GAZODUC,,
203621,SOCIETE TOUT TRANSPORT KOUTINE KOUTINE MEDENINE,GENERAL,TRANSPORT,SOCIETE TOUT TRANSPORT KOUTINE,TRANSPORT ROUTIER MARCHANDISE,,
203661,T T R  LA TUNISIENNE DE TRANSPORT ROUTIER RUE HAMBOURG ZONE PORTUAIRE RADES,GENERAL,TRANSPORT,T T R  LA TUNISIENNE DE TRANSPORT ROUTIER,TRANSPORT ROUTIER MARCHANDISE,,
203791,SOCIETE MAGHREBINE DE TRANSPORT TERRESTRE AV HEDI NOUIRA RTE DU BAC RADES,GENERAL,TRANSPORT,SOCIETE MAGHREBINE DE TRANSPORT TERRESTRE,TRANSPORT ROUTIER MARCHANDISE,,
204011,SOCIETE CHAABANE FRERES IMM.MEDINA CENTRE ROUTE GREMDA,GENERAL,TRANSPORT,SOCIETE CHAABANE FRERES,TRANSPORT ROUTIER MARCHANDISE,,
204041,"C T N ""C O T U N A V "" RUE DAGHAMMARJOELD TUNIS",GENERAL,TRANSPORT,"COMPAGNIE TUNISIENNE DE NAVIGATION ""CTN""",TRANSPORT MARITIME CABOTAGE,,
204042,"C T N ""C O T U N A V "" RUE DAGHAMMARJOELD TUNIS",GENERAL,TRANSPORT,"COMPAGNIE TUNISIENNE DE NAVIGATION ""CTN""",TRANSPORT MARITIME CABOTAGE,,
204501,ROSSEMARE INTERNATIONAL SNDP AV MOHAMED ALI AKID EL KHADRA TUNIS,GENERAL,TRANSPORT,ROSSEMARE INTERNATIONAL,TRANSPORT MARITIME BUNKERS,,
204731,TUNIS AVIA BOULEVARD DU LEADER YASSER ARAFAT TUNIS CARTE,GENERAL,TRANSPORT,TUNIS AVIA,TRANSPORT AERIEN,,
204741,S O C O D A L DAR ALLOUCHE,GENERAL,TRANSPORT,S O C O D A L,AUTRES INDUSTRIES ALIMENTAIRES,,
205021,SOCIETE REGIONALE DE TRANSPORT DE BIZERTE RUE 20 MARS 1956 BIZERTE,GENERAL,TRANSPORT,SOCIETE REGIONALE DE TRANSPORT DE BIZERTE,TRANSPORT ROUTIER PARTICULIER (NON MARCH.),,
205022,SOCIETE REGIONALE DE TRANSPORT DE BIZERTE RUE 20 MARS 1956 BIZERTE,GENERAL,TRANSPORT,SOCIETE REGIONALE DE TRANSPORT DE BIZERTE,TRANSPORT ROUTIER PARTICULIER (NON MARCH.),,
205061,"S O R E T R A S RTE DE MENZEL CHAKER KM0,5 RUE MOUNA SFAX",GENERAL,TRANSPORT,S O R E T R A S,TRANSPORT ROUTIER PARTICULIER (NON MARCH.),,
205062,"S O R E T R A S RTE DE MENZEL CHAKER KM0,5 RUE MOUNA SFAX",GENERAL,TRANSPORT,S O R E T R A S,TRANSPORT ROUTIER PARTICULIER (NON MARCH.),,
205431,S . O . M . A . H . A 129 RUE HEDI NOUIRA RADES SALINE,GENERAL,TRANSPORT,S . O . M . A . H . A,COMMERCE,,
205541,STE TRANSPORT DU SAHEL RUE LEOPOLD SENGHOR SOUSSE,GENERAL,TRANSPORT,STE TRANSPORT DU SAHEL,TRANSPORT ROUTIER PARTICULIER (NON MARCH.),,
205542,STE TRANSPORT DU SAHEL RUE LEOPOLD SENGHOR SOUSSE,GENERAL,TRANSPORT,STE TRANSPORT DU SAHEL,TRANSPORT ROUTIER PARTICULIER (NON MARCH.),,
205611,"MEDITERREAN SHIPPING AGENCY ""MEDSHIP"" 22 BIS AV HABIB THAMEUR TUNIS",GENERAL,TRANSPORT,"MEDITERREAN SHIPPING AGENCY ""MEDSHIP""",TRANSPORT MARITIME BUNKERS,,
