NUMCPT,NOMCLI,TYPE_CLIENT,SECTEUR_CLIENT,CONSOLIDATION_CLIENT,CODAME,CODGVR,SERVICE_TYPE
670972,MIN.ENS.SUP.RECH.SC.TECH.INSTITUT SUP.DES SCIENCES INFIRMIERS,GENERAL,ADMINISTRATION,INSTITUT SUP.DES SCIENCES INFIRMIERS,MIN.ENS.SUP.RECH.SC.,,
670982,MIN.ENS.SUP.RECH.SC. FACULTE DES SCIENCES ECONOM.ET GESTION,GENERAL,ADMINISTRATION,MIN.ENS.SUP.RECH.SC. FACULTE DES SCIENCES ECONOM.ET GESTION,MIN.ENS.SUP.RECH.SC.,,
671012,MIN.AGRIC.ENV.RESS.HYD.C.R.D.A. DU KEF,GENERAL,ADMINISTRATION,C.R.D.A. DE KEF,MIN.AGRIC.ENV.RESS.HYD.,,
671022,MIN.AGRIC.ENV.RESS.HYD.C.R.D.A. JENDOUBA,GENERAL,ADMINISTRATION,C.R.D.A. DE JENDOUBA,MIN.AGRIC.ENV.RESS.HYD.,,
671042,"MIN.AGRIC.ENV.RESS.HYD.ECOLE SUP.D'AGRIC. "" PROJET DE RECH.AGRICOL",GENERAL,ADMINISTRATION,"ECOLE SUP.D'AGRIC. "" PROJET DE RECH.AGRICOL",MIN.AGRIC.ENV.RESS.HYD.,,
671052,MIN.AGRIC.ENV.RESS.HYD.C.R.D.A. DE BIZERTE,GENERAL,ADMINISTRATION,C.R.D.A. DE BIZERTE,MIN.AGRIC.ENV.RESS.HYD.,,
671062,MIN.AGRIC.ENV.RESS.HYD.C.F.P.A,GENERAL,ADMINISTRATION,C.F.P.A,MIN.AGRIC.ENV.RESS.HYD.,,
671072,MIN.AGRIC.ENV.RESS.HYD.CFPR AGRI-APICOLE,GENERAL,ADMINISTRATION,CFPR AGRI-APICOLE,MIN.AGRIC.ENV.RESS.HYD.,,
671082,MIN.AGRIC.ENV.RESS.HYD.CENTRE DE FORM.ET DE RECYCLAGE AGRICOLE,GENERAL,ADMINISTRATION,CENTRE DE FORM.ET DE RECYCLAGE AGRICOLE,MIN.AGRIC.ENV.RESS.HYD.,,
671091,MIN.AGRIC.ENV.RESS.HYD.INSTITUT NAT.DES GRANDES CULTURE,GENERAL,ADMINISTRATION,INSTITUT NAT.DES GRANDES CULTURE,MIN.AGRIC.ENV.RESS.HYD.,,
671102,MIN.AGRIC.ENV.RESS.HYD.DIR.GLE.DES BARRAGES - BARRAGE R'MIL ET SARRAT,GENERAL,ADMINISTRATION,DIR.GLE.DES BARRAGES - BARRAGE R'MIL ET SARRAT,MIN.AGRIC.ENV.RESS.HYD.,,
671112,MIN.AGRIC.ENV.RESS.HYD.DIR.GLE.DES BARRAGES - BARRAGE ZERGA -,GENERAL,ADMINISTRATION,DIR.GLE.DES BARRAGES - BARRAGE ZERGA -,MIN.AGRIC.ENV.RESS.HYD.,,
671122,MIN.AGRIC.ENV.RESS.HYD.CENTRE SECT.FORM.PROF.PATRONS HAUTURIERS,GENERAL,ADMINISTRATION,CENTRE SECT.FORM.PROF.PATRONS HAUTURIERS,MIN.AGRIC.ENV.RESS.HYD.,,
671142,MIN.AGRIC.ENV.RESS.HYD.DIR.GLE.DES BARRAGES - BARRAGE EL KEBIR -,GENERAL,ADMINISTRATION,DIR.GLE.DES BARRAGES - BARRAGE EL KEBIR -,MIN.AGRIC.ENV.RESS.HYD.,,
671152,MIN.AGRIC.ENV.RESS.HYD.C.R.D.A JENDOUBA - PROJET DRI/GRN,GENERAL,ADMINISTRATION,C.R.D.A JENDOUBA - PROJET DRI/GRN,MIN.AGRIC.ENV.RESS.HYD.,,
671192,MIN.AGRIC.ENV.RESS.HYD.ECOLE SUP.D'AGRIC. - CONVENTION RECH.DEVELO,GENERAL,ADMINISTRATION,ECOLE SUP.D'AGRIC. - CONVENTION RECH.DEVELO,MIN.AGRIC.ENV.RESS.HYD.,,
671202,MIN.AGRIC.ENV.RESS.HYD.C.R.D.A BIZERTE -  PROJET DRI / GRN,GENERAL,ADMINISTRATION,C.R.D.A BIZERTE -  PROJET DRI / GRN,MIN.AGRIC.ENV.RESS.HYD.,,
671212,MIN.AGRIC.ENV.RESS.HYD.C.R.D.A.BEJA,GENERAL,ADMINISTRATION,C.R.D.A.DE BEJA,MIN.AGRIC.ENV.RESS.HYD.,,
671222,MIN.AGRIC.ENV.RESS.HYD.CENTRE DE FORM.PROF.AGRICOLE DU KEF,GENERAL,ADMINISTRATION,CENTRE DE FORM.PROF.AGRICOLE DU KEF,MIN.AGRIC.ENV.RESS.HYD.,,
671252,MIN.AGRIC.ENV.RESS.HYD.ARROND.GENIE RURAL LE KEF,GENERAL,ADMINISTRATION,ARROND.GENIE RURAL LE KEF,MIN.AGRIC.ENV.RESS.HYD.,,
671262,MIN.AGRIC.ENV.RESS.HYD. POLE REG.RECH.DEVELOP.AGRIC.,GENERAL,ADMINISTRATION,POLE REG.RECH.DEVELOP.AGRIC.,MIN.AGRIC.ENV.RESS.HYD.,,
671272,MIN.AGRIC.ENV.RESS.HYD. INSTITUT SUP.DE PECHE ET AQUACULTURE,GENERAL,ADMINISTRATION,INSTITUT SUP.DE PECHE ET AQUACULTURE,MIN.AGRIC.ENV.RESS.HYD.,,
671282,MIN.AGRIC.CENTRE REG.DES RECH.EN GRANDES CULT.,GENERAL,ADMINISTRATION,MIN.AGRIC.CENTRE REG.DES RECH.EN GRANDES CULT.,MIN.AGRIC.ENV.RESS.HYD.,,
671322,"MIN.AGRIC.ENV.RESS.HYD.DGBTH  BARRAGES   MELAH, ETTINE,DOUIMIS",GENERAL,ADMINISTRATION,"DGBTH  BARRAGES   MELAH, ETTINE,DOUIMIS",MIN.AGRIC.ENV.RESS.HYD.,,
671342,MIN.AGRIC.POLE TECHNOLOGIQUE DE SUD,GENERAL,ADMINISTRATION,POLE TECHNOLOGIQUE DE SUD,MIN.AGRIC.ENV.RESS.HYD.,,
671352,MIN  INT.    COMMUNE DE  UTIQUE,GENERAL,ADMINISTRATION,COMMUNE DE UTIQUE,MIN.INTER.DEV.LOC.,,
671592,MIN.AGRIC.ENV.RESS.HYD.CENTRE DE FORM. PROF. AGRIC.DANS LE SECTEUR,GENERAL,ADMINISTRATION,CENTRE DE FORM. PROF. AGRIC.DANS LE SECTEUR,MIN.AGRIC.ENV.RESS.HYD.,,
671602,MIN.AGRIC.ENV.RESS.HYD. C.F.P.A,GENERAL,ADMINISTRATION,C.F.P.A,MIN.AGRIC.ENV.RESS.HYD.,,
671612,MIN.AGRIC.ENV.RESS.HYD.CENTRE DE PERF.ET DE RECYCLAGE AGRICOLE,GENERAL,ADMINISTRATION,CENTRE DE PERF.ET DE RECYCLAGE AGRICOLE,MIN.AGRIC.ENV.RESS.HYD.,,
671632,MIN.AGRIC.ENV.RESS.HYD.ECOLE SUPERIEURE EQUIPEMENT RURAL,GENERAL,ADMINISTRATION,ECOLE SUPERIEURE EQUIPEMENT RURAL,MIN.AGRIC.ENV.RESS.HYD.,,
671642,MIN.AGRIC.ENV.RESS.HYD.ECOLE SUPERIEUR AGRICULTURE,GENERAL,ADMINISTRATION,ECOLE SUPERIEURE D'AGRICULTURE,MIN.AGRIC.ENV.RESS.HYD.,,
671702,MIN.AGRIC.ENV.RESS.HYD.ARROND.FORETS SILIANA,GENERAL,ADMINISTRATION,ARROND.FORETS SILIANA,MIN.AGRIC.ENV.RESS.HYD.,,
671712,MIN.AGRIC.ENV.RESS.HYD.DIR.P V PROJET APMANE,GENERAL,ADMINISTRATION,DIR.P V PROJET APMANE,MIN.AGRIC.ENV.RESS.HYD.,,
671722,MIN.AGRIC.ENV.RESS.HYD.PROJET SIDA DIR.APM,GENERAL,ADMINISTRATION,PROJET SIDA DIR.APM,MIN.AGRIC.ENV.RESS.HYD.,,
671732,MIN.AGRIC.ENV.RESS.HYD.C.R.D.A. DE SILIANA,GENERAL,ADMINISTRATION,C.R.D.A. DE SILIANA,MIN.AGRIC.ENV.RESS.HYD.,,
671742,MIN.AGRIC.ENV.RESS.HYD.PROJET RECH.SYS.AGRIC.EN SEC.-ECOLE SUP.D'A,GENERAL,ADMINISTRATION,PROJET RECH.SYS.AGRIC.EN SEC.-ECOLE SUP.D'A,MIN.AGRIC.ENV.RESS.HYD.,,
671752,MIN.AGRIC.ENV.RESS.HYD.C.F.P. PECHES,GENERAL,ADMINISTRATION,C.F.P. PECHES,MIN.AGRIC.ENV.RESS.HYD.,,
671761,MIN.AGRIC.ENV.RESS.HYD.DGTH PROJET SIDI BARRAK,GENERAL,ADMINISTRATION,DGTH PROJET SIDI BARRAK,MIN.AGRIC.ENV.RESS.HYD.,,
671771,MIN.AGRIC.ENV.RESS.HYD.PROJET CONDUITE JOUMINE,GENERAL,ADMINISTRATION,PROJET CONDUITE JOUMINE,MIN.AGRIC.ENV.RESS.HYD.,,
671782,MIN.AGRIC.ENV.RESS.HYD.PROJET CONDUITE SIDI EL BARRAK,GENERAL,ADMINISTRATION,PROJET CONDUITE SIDI EL BARRAK,MIN.AGRIC.ENV.RESS.HYD.,,
671791,MIN.AGRIC.ENV.RESS.HYD.ODESYPANO BEJA -PROJET DE SEJNENE-,GENERAL,ADMINISTRATION,ODESYPANO BEJA - PROJET DE SEJNENE-,MIN.AGRIC.ENV.RESS.HYD.,,
671801,MIN.AGRIC.ENV.RESS.HYD.ODESYPANO BEJA -PROJET DE AIN DRAHEM-,GENERAL,ADMINISTRATION,ODESYPANO BEJA - PROJET DE AIN DRAHEM-,MIN.AGRIC.ENV.RESS.HYD.,,
671812,MIN.AGRIC.ENV.RESS.HYD.ODESYPANO BEJA  - PROJET DE BEJA -,GENERAL,ADMINISTRATION,ODESYPANO BEJA  - PROJET DE BEJA -,MIN.AGRIC.ENV.RESS.HYD.,,
671821,MIN.AGRIC.ENV.RESS.HYD.ODESYPANO  BEJA - PROJET DE JENDOUBA -,GENERAL,ADMINISTRATION,ODESYPANO  BEJA - PROJET DE JENDOUBA -,MIN.AGRIC.ENV.RESS.HYD.,,
671831,MIN.AGRIC.ENV.RESS.HYD.ODESYPANO BEJA - DIRECTION REGIONALE -,GENERAL,ADMINISTRATION,ODESYPANO BEJA - DIRECTION REGIONALE -,MIN.AGRIC.ENV.RESS.HYD.,,
671841,MIN.AGRIC.ENV.RESS.HYD.ODESYPANO BEJA  - PROJET DU KEF -,GENERAL,ADMINISTRATION,ODESYPANO BEJA - PROJET DU KEF -,MIN.AGRIC.ENV.RESS.HYD.,,
671852,MIN.AGRIC.ENV.RESS.HYD.UNITE D'AMENAGEMENT DE SIDI EL BARRAK,GENERAL,ADMINISTRATION,UNITE D'AMENAGEMENT DE SIDI EL BARRAK,MIN.AGRIC.ENV.RESS.HYD.,,
671862,MIN.AGRIC.ENV.RESS.HYD.CENTRE BETTERAVIER BOUSALEM,GENERAL,ADMINISTRATION,CENTRE BETTERAVIER BOUSALEM,MIN.AGRIC.ENV.RESS.HYD.,,
672012,MIN.SANTE PUB.HOPITAL M'HAMED BOURGUIBA DU KEF,GENERAL,ADMINISTRATION,HOPITAL M'HAMED BOURGUIBA DU KEF,MIN.SANTE PUB.,,
672022,MIN.SANTE PUB.GROUPEMENT DE SANTE DE BASE,GENERAL,ADMINISTRATION,GROUPEMENT DE SANTE DE BASE,MIN.SANTE PUB.,,
672032,MIN.SANTE PUB.GROUPEMENT DE SOINS DE SANTE DE BASE,GENERAL,ADMINISTRATION,GROUPEMENT DE SOINS DE SANTE DE BASE,MIN.SANTE PUB.,,
672042,MIN.SANTE PUB.HOP. REGIONAL TAJEROUINE,GENERAL,ADMINISTRATION,HOP. REGIONAL TAJEROUINE,MIN.SANTE PUB.,,
672052,MIN.SANTE PUB.HOPITAL CIRCONSCRIPTION DE MAKTHAR,GENERAL,ADMINISTRATION,HOPITAL CIRCONSCRIPTION DE MAKTHAR,MIN.SANTE PUB.,,
672062,MIN.SANTE PUB.HOPITAL REGIONAL DE SILIANA,GENERAL,ADMINISTRATION,HOPITAL REGIONAL DE SILIANA,MIN.SANTE PUB.,,
672072,MIN.SANTE PUB. HOPITAL CIRCONS.DE NEBEUR,GENERAL,ADMINISTRATION,HOPITAL CIRCONS.DE NEBEUR,MIN.SANTE PUB.,,
672082,MIN.SANTE PUB.HOPITAL DE CIRCONS. DE CIRCONS DE SAKIET SI,GENERAL,ADMINISTRATION,HOPITAL DE CIRCONS. DE CIRCONS DE SAKIET SI,MIN.SANTE PUB.,,
672092,MIN.SANTE PUB.HOP. REGIONAL DE BEJA,GENERAL,ADMINISTRATION,HOP. REGIONAL DE BEJA,MIN.SANTE PUB.,,
672102,MIN.SANTE PUB. INSTITUT  SUP. DES SC. INFIRMIERES,GENERAL,ADMINISTRATION,INSTITUT  SUP. DES SC. INFIRMIERES,MIN.SANTE PUB.,,
672112,MIN.SANTE PUB. GROUPEMENT DE SANTE  DE BASE,GENERAL,ADMINISTRATION,GROUPEMENT DE SANTE  DE BASE,MIN.SANTE PUB.,,
672122,MIN.SANTE PUB.HOPITAL CIRCONS. DE MEDJEZ EL BAB,GENERAL,ADMINISTRATION,HOPITAL CIRCONS. DE MEDJEZ EL BAB,MIN.SANTE PUB.,,
672131,MIN.SANTE PUB.HOPITAL DE TEBOURSOUK,GENERAL,ADMINISTRATION,HOPITAL DE TEBOURSOUK,MIN.SANTE PUB.,,
672132,MIN.SANTE PUB.HOPITAL DE TEBOURSOUK,GENERAL,ADMINISTRATION,HOPITAL DE TEBOURSOUK,MIN.SANTE PUB.,,
672142,MIN.SANTE PUB.HOPITAL CIRCONS. DE BOUARADA,GENERAL,ADMINISTRATION,HOPITAL CIRCONS. DE BOUARADA,MIN.SANTE PUB.,,
672152,MIN.SANTE PUB.HOPITAL CIRCONSCRIPTION DE GAAFOUR,GENERAL,ADMINISTRATION,HOPITAL CIRCONSCRIPTION DE GAAFOUR,MIN.SANTE PUB.,,
672162,MIN.SANTE PUB.HOPITAL AUXILIARE TESTOUR,GENERAL,ADMINISTRATION,HOPITAL AUXILIARE TESTOUR,MIN.SANTE PUB.,,
672172,MIN.SANTE PUB.  HOPITAL  CIRCONSCRIPTION  DE SERS,GENERAL,ADMINISTRATION,HOPITAL CIRCONSCRIPTION DE SERS LE SERS,MIN.SANTE PUB.,,
672182,MIN.SANTE PUB. HOPITAL CIRCONS. DE CHERARDA,GENERAL,ADMINISTRATION,HOPITAL CIRCONS. DE CHERARDA,MIN.SANTE PUB.,,
672192,MIN.SANTE PUB.HOPITAL REGIONAL DE JENDOUBA,GENERAL,ADMINISTRATION,HOPITAL REGIONAL DE JENDOUBA,MIN.SANTE PUB.,,
672202,MIN.SANTE PUB. HOPITAL CIRCONS. DE JOUMINE,GENERAL,ADMINISTRATION,HOPITAL CIRCONS. DE JOUMINE,MIN.SANTE PUB.,,
672232,MIN.SANTE PUB.HOPITAL CIRCONS. DE GHARDIMAOU,GENERAL,ADMINISTRATION,HOPITAL CIRCONS. DE GHARDIMAOU,MIN.SANTE PUB.,,
672242,MIN.SANTE PUB.HOPITAL REGIONAL DE AIN DRAHEM,GENERAL,ADMINISTRATION,HOPITAL REGIONAL DE AIN DRAHEM,MIN.SANTE PUB.,,
672252,MIN.SANTE PUB.HOPITAL CIRCONS. DE TABARKA,GENERAL,ADMINISTRATION,HOPITAL CIRCONS. DE TABARKA,MIN.SANTE PUB.,,
672312,MIN.SANTE PUB.HOP. REGIONAL BOUGATFA,GENERAL,ADMINISTRATION,HOP. REGIONAL BOUGATFA,MIN.SANTE PUB.,,
672332,MIN.SANTE PUB.HOP. REGIONAL MENZEL BOURGUIBA,GENERAL,ADMINISTRATION,HOP. REGIONAL MENZEL BOURGUIBA,MIN.SANTE PUB.,,
672342,MIN.SANTE PUB.HOPITAL DE MENZEL BOURGUIBA,GENERAL,ADMINISTRATION,HOPITAL DE MENZEL BOURGUIBA,MIN.SANTE PUB.,,
672352,MIN.SANTE PUB.HOPITAL CIRCONS. DE MATEUR,GENERAL,ADMINISTRATION,HOPITAL CIRCONS. DE MATEUR,MIN.SANTE PUB.,,
672372,MIN.SANTE PUB.ECOLE PROF.SANTE PUB.,GENERAL,ADMINISTRATION,ECOLE PROF.SANTE PUB.,MIN.SANTE PUB.,,
672382,MIN.SANTE PUB.HOPITAL CIRCONSCRIPTION DE BOUSALEM,GENERAL,ADMINISTRATION,HOPITAL CIRCONSCRIPTION DE BOUSALEM,MIN.SANTE PUB.,,
672392,MIN.SANTE PUB.HOPITAL CIRCONS. DE AIN DRAHEM,GENERAL,ADMINISTRATION,HOPITAL CIRCONS. DE AIN DRAHEM,MIN.SANTE PUB.,,
672422,MIN.SANTE PUB. ECOLE DES SCIENCES INFIRMIERES,GENERAL,ADMINISTRATION,ECOLE DES SCIENCES INFIRMIERES,MIN.SANTE PUB.,,
672432,MIN.SANTE PUB.HOPITAL CIRCONS. DAHMANI,GENERAL,ADMINISTRATION,HOPITAL CIRCONS. DAHMANI,MIN.SANTE PUB.,,
672442,MIN.SANTE PUB.HOPITAL HASSEN BELKHOUJA,GENERAL,ADMINISTRATION,HOPITAL HASSEN BELKHOUJA,MIN.SANTE PUB.,,
672452,MIN.SANTE PUB.HOPITAL CIRCONS.DE ROUHIA,GENERAL,ADMINISTRATION,HOPITAL CIRCONS.DE ROUHIA,MIN.SANTE PUB.,,
672462,MIN.SANTE PUB.HOPITAL CIRCONS. EL KRIB,GENERAL,ADMINISTRATION,HOPITAL CIRCONS. EL KRIB,MIN.SANTE PUB.,,
672472,MIN.SANTE PUB.HOPITAL CIRCONSCRIPTION DE BARGOU,GENERAL,ADMINISTRATION,HOPITAL CIRCONSCRIPTION DE BARGOU,MIN.SANTE PUB.,,
672482,MIN.SANTE PUB.HOPITAL DE ROUHIA,GENERAL,ADMINISTRATION,HOPITAL DE ROUHIA,MIN.SANTE PUB.,,
672492,MIN.SANTE PUB.DIR.REG.SANTE PUB.,GENERAL,ADMINISTRATION,DIR.REG.SANTE PUB.,MIN.SANTE PUB.,,
672502,MIN.SANTE PUB.ECOLE PROF. DE LA SANTE PUB. BEJA,GENERAL,ADMINISTRATION,ECOLE PROF. DE LA SANTE PUB. BEJA,MIN.SANTE PUB.,,
672512,MIN.SANTE PUB.HOPITAL CIRCONS.DE AMDOUN,GENERAL,ADMINISTRATION,HOPITAL CIRCONS.DE AMDOUN,MIN.SANTE PUB.,,
672522,MIN.SANTE PUB.HOPITAL CIRCONS. DE NEFZA,GENERAL,ADMINISTRATION,HOPITAL CIRCONS. DE NEFZA,MIN.SANTE PUB.,,
672532,MIN.SANTE PUB.ECOLE PROF. DE LA SANTE PUBLIQUE,GENERAL,ADMINISTRATION,ECOLE PROF. DE LA SANTE PUBLIQUE,MIN.SANTE PUB.,,
672542,MIN.SANTE PUB.ECOLE DES SC.INFIRMIERES,GENERAL,ADMINISTRATION,ECOLE DES SC.INFIRMIERES,MIN.SANTE PUB.,,
672552,MIN.SANTE PUB.HOPITAL CIRCONS. KESRA,GENERAL,ADMINISTRATION,HOPITAL CIRCONS. KESRA,MIN.SANTE PUB.,,
672562,MIN.SANTE PUB.DIR.REG.SANTE PUB.,GENERAL,ADMINISTRATION,DIR.REG.SANTE PUB.,MIN.SANTE PUB.,,
672572,MIN.SANTE PUB.ECOLE PROF.SANTE PUB.,GENERAL,ADMINISTRATION,ECOLE PROF.SANTE PUB.,MIN.SANTE PUB.,,
672592,MIN.SANTE PUB.HOPITAL CIRCONS. DE SIDI BOUROUIS,GENERAL,ADMINISTRATION,HOPITAL CIRCONS. DE SIDI BOUROUIS,MIN.SANTE PUB.,,
672602,MIN.SANTE PUB.CENTRE MATERNITE DE BIZERTE,GENERAL,ADMINISTRATION,CENTRE MATERNITE DE BIZERTE,MIN.SANTE PUB.,,
672612,MIN.SANTE PUB.HOPITAL EL KSOUR,GENERAL,ADMINISTRATION,HOPITAL EL KSOUR,MIN.SANTE PUB.,,
672622,MIN.SANTE PUB.HOPITAL DE GOUBELLAT,GENERAL,ADMINISTRATION,HOPITAL DE GOUBELLAT,MIN.SANTE PUB.,,
672631,MIN.SANTE PUB.HOPITAL CIRCONSCRIPTION EL ALIA,GENERAL,ADMINISTRATION,HOPITAL CIRCONSCRIPTION EL ALIA,MIN.SANTE PUB.,,
672632,MIN.SANTE PUB.HOPITAL CIRCONSCRIPTION EL ALIA,GENERAL,ADMINISTRATION,HOPITAL CIRCONSCRIPTION EL ALIA,MIN.SANTE PUB.,,
672642,MIN.SANTE PUB.DIR.REG.SANTE PUB.,GENERAL,ADMINISTRATION,DIR.REG.SANTE PUB.,MIN.SANTE PUB.,,
672652,MIN.SANTE PUB.CENTRE DE SOINS DE BASE,GENERAL,ADMINISTRATION,CENTRE DE SOINS DE BASE,MIN.SANTE PUB.,,
672662,MIN.SANTE PUB.DIR.REG.DE LA SANTE PUB.,GENERAL,ADMINISTRATION,DIR.REG.DE LA SANTE PUB.,MIN.SANTE PUB.,,
672672,MIN.SANTE PUB.DIR.REG.SANTE PUB.,GENERAL,ADMINISTRATION,DIR.REG.SANTE PUB.,MIN.SANTE PUB.,,
672682,MIN.SANTE PUB.GROUPEMENT DE SANTE DE BASE,GENERAL,ADMINISTRATION,GROUPEMENT DE SANTE DE BASE,MIN.SANTE PUB.,,
672692,MIN.SANTE PUB.HOPITAL DE SEJNANE,GENERAL,ADMINISTRATION,HOPITAL DE SEJNANE,MIN.SANTE PUB.,,
672702,MIN.SANTE PUB. GROUPEMENT DE SANTE DE BASE,GENERAL,ADMINISTRATION,GROUPEMENT DE SANTE DE BASE,MIN.SANTE PUB.,,
672712,MIN.SANTE PUB.GROUPEMENT DE SANTE DE BASE,GENERAL,ADMINISTRATION,GROUPEMENT DE SANTE DE BASE,MIN.SANTE PUB.,,
673012,MIN.INTER.DEV.LOC.CONSEIL DE GOUVERNORAT DU KEF,GENERAL,ADMINISTRATION,GOUVERNORAT DU KEF,MIN.INTER.DEV.LOC.,,
673022,MIN.INTER.DEV.LOC. GOUVERNORAT DE BEJA,GENERAL,ADMINISTRATION,GOUVERNORAT DE BEJA,MIN.INTER.DEV.LOC.,,
673032,MIN.INTER.DEV.LOC.COMMUNE MENZEL JEMIL,GENERAL,ADMINISTRATION,COMMUNE MENZEL JEMIL,MIN.INTER.DEV.LOC.,,
673042,MIN.INTER.DEV.LOC.CONSEIL DE GOUVERNORAT DE JENDOUBA,GENERAL,ADMINISTRATION,GOUVERNORAT DE JENDOUBA,MIN.INTER.DEV.LOC.,,
673052,MIN.INTER.DEV.LOC.COMMUNE DE BEJA,GENERAL,ADMINISTRATION,COMMUNE DE BEJA,MIN.INTER.DEV.LOC.,,
673062,MIN.JUSTICE DROITS HOMMECENTRE REEDUCATIF SAOUAF,GENERAL,ADMINISTRATION,CENTRE REEDUCATIF SAOUAF,MIN.JUSTICE DROITS HOMME,,
673072,MIN.INTER.DEV.LOC.COMMUNE MENZEL ABDERRAHMAN,GENERAL,ADMINISTRATION,COMMUNE MENZEL ABDERRAHMAN,MIN.INTER.DEV.LOC.,,
673082,MIN.INTER.DEV.LOC.COMMUNE DE MENZEL BOURGUIBA,GENERAL,ADMINISTRATION,COMMUNE DE MENZEL BOURGUIBA,MIN.INTER.DEV.LOC.,,
673092,MIN.INTER.DEV.LOC.GOUVERNORAT DE BIZERTE,GENERAL,ADMINISTRATION,GOUVERNORAT DE BIZERTE,MIN.INTER.DEV.LOC.,,
673102,MIN.INTER.DEV.LOC.COMMUNE DE ZAHRET MEDIEN,GENERAL,ADMINISTRATION,COMMUNE DE ZAHRET MEDIEN,MIN.INTER.DEV.LOC.,,
673112,MIN.JUSTICE DROITS HOMMEPRISON CIVILE DE SERS,GENERAL,ADMINISTRATION,PRISON CIVILE DE SERS,MIN.JUSTICE DROITS HOMME,,
673122,MIN.INTER.DEV.LOC.COMMUNE DE JENDOUBA,GENERAL,ADMINISTRATION,COMMUNE DE JENDOUBA,MIN.INTER.DEV.LOC.,,
673132,MIN.INTER.DEV.LOC.COMMUNE DE MATEUR,GENERAL,ADMINISTRATION,COMMUNE DE MATEUR,MIN.INTER.DEV.LOC.,,
673142,MIN.INTER.DEV.LOC.CONSEIL GOUVERNORAT DE BEJA,GENERAL,ADMINISTRATION,CONSEIL GOUVERNORAT DE BEJA,MIN.INTER.DEV.LOC.,,
673152,MIN.INTER.DEV.LOC.COMMUNE DE KALAAT EL ANDALOUS,GENERAL,ADMINISTRATION,COMMUNE DE KALAAT EL ANDALOUS,MIN.INTER.DEV.LOC.,,
673162,MIN.INTER.DEV.LOC.CONSEIL GOUVERNORAT - UNITE DE CONTROLE DE,GENERAL,ADMINISTRATION,CONSEIL GOUVERNORAT - UNITE DE CONTROLE DE,MIN.INTER.DEV.LOC.,,
673172,MIN.INTER.DEV.LOC.CONSEIL GOUVERNORAT DE BEJA,GENERAL,ADMINISTRATION,CONSEIL GOUVERNORAT DE BEJA,MIN.INTER.DEV.LOC.,,
673182,MIN.INTER.DEV.LOC.COMMUNE OUED MELLIZ,GENERAL,ADMINISTRATION,COMMUNE OUED MELLIZ,MIN.INTER.DEV.LOC.,,
673192,MIN.INTER.DEV.LOC.COMMUNE DJERISSA,GENERAL,ADMINISTRATION,COMMUNE DJERISSA,MIN.INTER.DEV.LOC.,,
673202,MIN.INTER.DEV.LOC.COMMUNE DE RAFRAF,GENERAL,ADMINISTRATION,COMMUNE DE RAFRAF,MIN.INTER.DEV.LOC.,,
673212,MIN.INTER.DEV.LOC.COMMUNE DE METLINE,GENERAL,ADMINISTRATION,COMMUNE DE METLINE,MIN.INTER.DEV.LOC.,,
673222,MIN.INTER.DEV.LOC.COMMUNE DE GAAFOUR,GENERAL,ADMINISTRATION,COMMUNE DE GAAFOUR,MIN.INTER.DEV.LOC.,,
673232,MIN.INTER.DEV.LOC.COMMUNE DE KALAAT SENAN,GENERAL,ADMINISTRATION,COMMUNE DE KALAAT SENAN,MIN.INTER.DEV.LOC.,,
673242,MIN.INTER.DEV.LOC.COMMUNE LAROUSSA,GENERAL,ADMINISTRATION,COMMUNE LAROUSSA,MIN.INTER.DEV.LOC.,,
673252,MIN.INTER.DEV.LOC.COMMUNE EL ALIA,GENERAL,ADMINISTRATION,COMMUNE EL ALIA,MIN.INTER.DEV.LOC.,,
673262,MIN.INTER.DEV.LOC.COMMUNE MEDJEZ EL BAB,GENERAL,ADMINISTRATION,COMMUNE MEDJEZ EL BAB,MIN.INTER.DEV.LOC.,,
673272,MIN.INTER.DEV.LOC.GOUVERNORAT BIZERTE- DIRECTION DE LA SURETE,GENERAL,ADMINISTRATION,GOUVERNORAT BIZERTE- DIRECTION DE LA SURETE,MIN.INTER.DEV.LOC.,,
673282,MIN.INTER.DEV.LOC.GOUVERNORAT DE BEJA- SURETE NATIONALE DE BE,GENERAL,ADMINISTRATION,GOUVERNORAT DE BEJA- DIRECTION DE LA SURETE,MIN.INTER.DEV.LOC.,,
673292,MIN.INTER.DEV.LOC.GOUVERNORAT DE JENDOUBA- SECTEUR POLICE DE,GENERAL,ADMINISTRATION,GOUVERNORAT DE JENDOUBA- SECTEUR DE POLICE,MIN.INTER.DEV.LOC.,,
673302,MIN.INTER.DEV.LOC.GOUVERNORAT DU KEF- SECTEUR POLICE LE KEF,GENERAL,ADMINISTRATION,GOUVERNORAT DU KEF- SECTEUR DE POLICE,MIN.INTER.DEV.LOC.,,
673312,MIN.INTER.DEV.LOC.GOUVERNORAT DE SILIANA- SECTEUR DE POLICE S,GENERAL,ADMINISTRATION,GOUVERNORAT DE SILIANA- SECTEUR DE POLICE,MIN.INTER.DEV.LOC.,,
673322,MIN.INTER.DEV.LOC. COMMUNE DE MAAGOULA,GENERAL,ADMINISTRATION,COMMUNE DE MAAGOULA,MIN.INTER.DEV.LOC.,,
673332,MIN.INTER.DEV.LOC.COMMUNE DE TOUIREF,GENERAL,ADMINISTRATION,COMMUNE DE TOUIREF,MIN.INTER.DEV.LOC.,,
673342,MIN.INTER.DEV.LOC.ECOLE COMMONDOS DE LA GARDE NLE.,GENERAL,ADMINISTRATION,ECOLE COMMONDOS DE LA GARDE NLE.,MIN.INTER.DEV.LOC.,,
673352,MIN.INTER.DEV.LOC. COMMUNE DE MAKTHAR,GENERAL,ADMINISTRATION,COMMUNE DE MAKTHAR,MIN.INTER.DEV.LOC.,,
673362,MIN.INTER.DEV.LOC. COMMUNE DE GOUBELLAT,GENERAL,ADMINISTRATION,COMMUNE DE GOUBELLAT,MIN.INTER.DEV.LOC.,,
673372,MIN.INTER.DEV.LOC.COMMUNE BOUARADA,GENERAL,ADMINISTRATION,COMMUNE BOUARADA,MIN.INTER.DEV.LOC.,,
673382,MIN.EDUC.FORM.ECOLE PREPARATOIRE PILOTE,GENERAL,ADMINISTRATION,ECOLE PREPARATOIRE PILOTE,MIN.EDUC.,,
673392,MIN.INTER.DEV.LOC.MIN.INTER.  COMMUNE DE TABARKA,GENERAL,ADMINISTRATION,COMMUNE DE TABARKA,MIN.INTER.DEV.LOC.,,
673402,MIN.INTER.DEV.LOC.COMMUNE DE BOUSALEM,GENERAL,ADMINISTRATION,COMMUNE DE BOUSALEM,MIN.INTER.DEV.LOC.,,
673412,MIN.INTER.DEV.LOC.COMMUNE DAHMANI,GENERAL,ADMINISTRATION,COMMUNE DAHMANI,MIN.INTER.DEV.LOC.,,
673422,MIN.INTER.DEV.LOC. COMMUNE NEBEUR,GENERAL,ADMINISTRATION,COMMUNE NEBEUR,MIN.INTER.DEV.LOC.,,
673432,MIN.INTER.DEV.LOC.CONSEIL DE GOUVERNORAT DU BIZERTE,GENERAL,ADMINISTRATION,GOUVERNORAT DU BIZERTE,MIN.INTER.DEV.LOC.,,
673442,MIN.INTER.DEV.LOC.COMMUNE DE SILIANA,GENERAL,ADMINISTRATION,COMMUNE DE SILIANA,MIN.INTER.DEV.LOC.,,
673452,MIN.INTER.DEV.LOC.GOUVERNORAT DE JENDOUBA,GENERAL,ADMINISTRATION,GOUVERNORAT DE JENDOUBA,MIN.INTER.DEV.LOC.,,
673462,MIN.INTER.DEV.LOC.CONSEIL GOUVERNORAT      P. D. R.,GENERAL,ADMINISTRATION,CONSEIL GOUVERNORAT      P. D. R.,MIN.INTER.DEV.LOC.,,
673472,MIN.JUSTICE DROITS HOMMEPRISON CIVIL DU KEF,GENERAL,ADMINISTRATION,PRISON CIVIL DU KEF,MIN.JUSTICE DROITS HOMME,,
673482,MIN.INTER.DEV.LOC.GOUVERNORAT DE SILIANA,GENERAL,ADMINISTRATION,GOUVERNORAT DE SILIANA,MIN.INTER.DEV.LOC.,,
673492,MIN.INTER. COMMUNE MENZEL M'HIRI,GENERAL,ADMINISTRATION,COMMUNE MENZEL M'HIRI,MIN.INTER.DEV.LOC.,,
673502,MIN.INTER.  COMMUNE DE KESRA,GENERAL,ADMINISTRATION,COMMUNE DE KESRA,MIN.INTER.DEV.LOC.,,
673512,MIN.JUSTICE DROITS HOMMEPRISON DE BORJ ERROUMI,GENERAL,ADMINISTRATION,PRISON DE BORJ ERROUMI,MIN.JUSTICE DROITS HOMME,,
673522,MIN.JUSTICE DROITS HOMMEPRISON CIVIL DE NADHOUR,GENERAL,ADMINISTRATION,PRISON CIVIL DE NADHOUR,MIN.JUSTICE DROITS HOMME,,
673532,MIN.INTER.DEV.LOC.COMMUNE DE AIN DRAHEM,GENERAL,ADMINISTRATION,COMMUNE DE AIN DRAHEM,MIN.INTER.DEV.LOC.,,
673542,MIN.JUSTICE DROITS HOMMECENTRE DE REEDUCATION DES MINEURS,GENERAL,ADMINISTRATION,CENTRE DE REEDUCATION DES MINEURS,MIN.JUSTICE DROITS HOMME,,
673552,MIN.INTER.DEV.LOC.COMMUNE DE GHARDIMAOU,GENERAL,ADMINISTRATION,COMMUNE DE GHARDIMAOU,MIN.INTER.DEV.LOC.,,
673562,MIN.INTER.DEV.LOC.COMMUNE DE NEFZA,GENERAL,ADMINISTRATION,COMMUNE DE NEFZA,MIN.INTER.DEV.LOC.,,
673572,MIN.JUSTICE DROITS HOMMEPRISON CIVILE DE BIZERTE,GENERAL,ADMINISTRATION,PRISON CIVILE DE BIZERTE,MIN.JUSTICE DROITS HOMME,,
673582,MIN.INTER.DEV.LOC.COMMUNE DE RAS JEBEL,GENERAL,ADMINISTRATION,COMMUNE DE RAS JEBEL,MIN.INTER.DEV.LOC.,,
673592,MIN.INTER.DEV.LOC.COMMUNE DE SEJNENE,GENERAL,ADMINISTRATION,COMMUNE DE SEJNENE,MIN.INTER.DEV.LOC.,,
673602,MIN.INTER.DEV.LOC.COMMUNE DE BARGOU,GENERAL,ADMINISTRATION,COMMUNE DE BARGOU,MIN.INTER.DEV.LOC.,,
673612,MIN.INTER.DEV.LOC.COMMUNE DE BIZERTE,GENERAL,ADMINISTRATION,COMMUNE DE BIZERTE,MIN.INTER.DEV.LOC.,,
673622,MIN.INTER.DEV.LOC.COMMUNE DE GHAR EL MELEH,GENERAL,ADMINISTRATION,COMMUNE DE GHAR EL MELEH,MIN.INTER.DEV.LOC.,,
673632,MIN.JUSTICE DROITS HOMMEPRISON CIVILE SILIANA,GENERAL,ADMINISTRATION,PRISON CIVILE SILIANA,MIN.JUSTICE DROITS HOMME,,
673642,MIN.JUSTICE DROITS HOMMEPRISON CIVILE EDDYR,GENERAL,ADMINISTRATION,PRISON CIVILE EDDYR,MIN.JUSTICE DROITS HOMME,,
673652,MIN.INTER.DEV.LOC.COMMUNE  LE KRIB,GENERAL,ADMINISTRATION,COMMUNE  LE KRIB,MIN.INTER.DEV.LOC.,,
673662,MIN.INTER.DEV.LOC.COMMUNE DE TAJEROUINE,GENERAL,ADMINISTRATION,COMMUNE DE TAJEROUINE,MIN.INTER.DEV.LOC.,,
673672,MIN.INTER.DEV.LOC.CONSEIL REGIONAL DE GOUVERNORAT DE BEJA  P.,GENERAL,ADMINISTRATION,CONSEIL REGIONAL DE GOUVERNORAT DE BEJA  P.,MIN.INTER.DEV.LOC.,,
673682,MIN.INTER.DEV.LOC.GOUVERNORAT DE BIZERTE  SCE. P.D.R,GENERAL,ADMINISTRATION,GOUVERNORAT DE BIZERTE  SCE. P.D.R,MIN.INTER.DEV.LOC.,,
673692,PRISON CIVILE DE BEJA,GENERAL,ADMINISTRATION,PRISON CIVILE DE BEJA,MIN.JUSTICE DROITS HOMME,,
673702,MIN.INTER.DEV.LOC.GOUVERNORAT DU KEF SCE ANIMATION RURALE,GENERAL,ADMINISTRATION,GOUVERNORAT DU KEF SCE ANIMATION RURALE,MIN.INTER.DEV.LOC.,,
673712,MIN.INTER.DEV.LOC.GOUVERNORAT DU KEF,GENERAL,ADMINISTRATION,GOUVERNORAT DU KEF,MIN.INTER.DEV.LOC.,,
673722,MIN.INTER.DEV.LOC.PRISON CIVILE BULLA-REGIA,GENERAL,ADMINISTRATION,PRISON CIVILE BULLA-REGIA,MIN.INTER.DEV.LOC.,,
673732,MIN.INTER.DEV.LOC.COMMUNE DE TINJA,GENERAL,ADMINISTRATION,COMMUNE DE TINJA,MIN.INTER.DEV.LOC.,,
673742,MIN.INTER.DEV.LOC.COMMUNE DE ROUHIA,GENERAL,ADMINISTRATION,COMMUNE DE ROUHIA,MIN.INTER.DEV.LOC.,,
673752,MIN.INTER.DEV.LOC.GOUVERNORAT DE SILIANA,GENERAL,ADMINISTRATION,GOUVERNORAT DE SILIANA,MIN.INTER.DEV.LOC.,,
673762,MIN.INTER.DEV.LOC.CONSEIL REG. DU GOUVERNORAT DE SILIANA,GENERAL,ADMINISTRATION,CONSEIL REG. DU GOUVERNORAT DE SILIANA,MIN.INTER.DEV.LOC.,,
673772,MIN.INTER.DEV.LOC.CONSEIL DE GOUVERNORAT DU KEF,GENERAL,ADMINISTRATION,CONSEIL DE GOUVERNORAT DU KEF,MIN.INTER.DEV.LOC.,,
673782,MIN.INTER.DEV.LOC.COMMUNE DU KEF,GENERAL,ADMINISTRATION,COMMUNE DU KEF,MIN.INTER.DEV.LOC.,,
673792,MIN.INTER.DEV.LOC.COMMUNE DE TEBOURSOUK,GENERAL,ADMINISTRATION,COMMUNE DE TEBOURSOUK,MIN.INTER.DEV.LOC.,,
673802,MIN.INTER.DEV.LOC.COMMUNE DE BENI METIR,GENERAL,ADMINISTRATION,COMMUNE DE BENI METIR,MIN.INTER.DEV.LOC.,,
673812,MIN.INTER.DEV.LOC.GOUVERNORAT DE JENDOUBA P D R I,GENERAL,ADMINISTRATION,GOUVERNORAT DE JENDOUBA P D R I,MIN.INTER.DEV.LOC.,,
673822,MIN.INTER.DEV.LOC.COMMUNE EL KSOUR,GENERAL,ADMINISTRATION,COMMUNE EL KSOUR,MIN.INTER.DEV.LOC.,,
673832,MIN.INTER.DEV.LOC.COMMUNE DE SAKIET SIDI YOUSSEF,GENERAL,ADMINISTRATION,COMMUNE DE SAKIET SIDI YOUSSEF,MIN.INTER.DEV.LOC.,,
673842,MIN.INTER.DEV.LOC.COMMUNE  DE KALAA EL KHASBA,GENERAL,ADMINISTRATION,COMMUNE  DE KALAA EL KHASBA,MIN.INTER.DEV.LOC.,,
673852,MIN.INTER.DEV.LOC.ECOLE NAT.DE FORMATION DES OFFIERS DE POLIC,GENERAL,ADMINISTRATION,ECOLE NAT.DE FORMATION DES OFFIERS DE POLIC,MIN.INTER.DEV.LOC.,,
673862,MIN.INTER.DEV.LOC.COMMUNE DE FERNANA,GENERAL,ADMINISTRATION,COMMUNE DE FERNANA,MIN.INTER.DEV.LOC.,,
673872,MIN.INTER.DEV.LOC.CAISSE DE LA PROM. DES ACIVITES DES JEUNES,GENERAL,ADMINISTRATION,CAISSE DE LA PROM. DES ACIVITES DES JEUNES,MIN.INTER.DEV.LOC.,,
673882,MIN.INTER.DEV.LOC.COMMUNE DE SERS,GENERAL,ADMINISTRATION,COMMUNE DE SERS,MIN.INTER.DEV.LOC.,,
673892,MIN.INTER.DEV.LOC.COMMUNE AOUSJA,GENERAL,ADMINISTRATION,COMMUNE AOUSJA,MIN.INTER.DEV.LOC.,,
673902,MIN.INTER.DEV.LOC.COMMUNE DE TESTOUR,GENERAL,ADMINISTRATION,COMMUNE DE TESTOUR,MIN.INTER.DEV.LOC.,,
673912,MIN.INTER.DEV.LOC.COMMUNE DE MENZEL SALEM,GENERAL,ADMINISTRATION,COMMUNE DE MENZEL SALEM,MIN.INTER.DEV.LOC.,,
673922,MIN.INTER. COMMUNE DE TAMERZA,GENERAL,ADMINISTRATION,COMMUNE DE TAMERZA,MIN.INTER.DEV.LOC.,,
673932,MIN.INTER.DEV.LOC. COMMUNE SIDI ALI BEN AOUN,GENERAL,ADMINISTRATION,COMMUNE SIDI ALI BEN AOUN,MIN.INTER.DEV.LOC.,,
673942,MIN.INTER.DEV.LOC. COMMUNE DE SIDI BOUROUIS,GENERAL,ADMINISTRATION,COMMUNE DE SIDI BOUROUIS,MIN.INTER.DEV.LOC.,,
673952,MIN.INTER. ECOLE NATIONALE DE LA PROTECTION CIVILE,GENERAL,ADMINISTRATION,ECOLE NATIONALE DE LA PROTECTION CIVILE,MIN.INTER.DEV.LOC.,,
673962,MIN.INTER.   COMMUNE AIN JELLOULA,GENERAL,ADMINISTRATION,COMMUNE AIN JELLOULA,MIN.INTER.DEV.LOC.,,
673972,MUNICIPALITE  SMAR,GENERAL,ADMINISTRATION,MUNICIPALITE SMAR,MIN.INTER.DEV.LOC.,,
673982,MINISTERE DE L'INTERIEUR   COMMUNE  EL  AMRA,GENERAL,ADMINISTRATION,MINISTERE DE L'INTERIEUR   EL  AMRA,MIN.INTER.DEV.LOC.,,
673992,MINISTERE DEVELOP.LOCAL   COMMUNE EL FAOUAR,GENERAL,ADMINISTRATION,MINISTERE DEVELOP.LOCAL  EL FAOUAR,MIN.INTER.DEV.LOC.,,
674012,MIN.SPORTSCOMM. REG. DES SPORTS,GENERAL,ADMINISTRATION,COMM. REG. DES SPORTS,MIN.JEUN.SPORTS EDUC.PHYS.,,
674022,MIN.AFF.FEM.FAM.ENF.CENTRE INTEGRE DE LA JEUN ET DE L'ENFANCE,GENERAL,ADMINISTRATION,CENTRE INTEGRE DE LA JEUN ET DE L'ENFANCE,MIN.AFF.FEM.FAM.ENF.,,
